{
  "pipeline": "standard",
  "timestamp": "2025-12-26T00:24:15.605336",
  "intent_filter": "roadmap",
  "total_queries": 2,
  "results": [
    {
      "question": "Học kỳ 1 ngành TTNT học những môn gì?",
      "answer": "Học kỳ 1 ngành Công nghệ Thông tin, sinh viên sẽ học các môn sau:\n\n**Môn bắt buộc:**\n\n*   Tư tưởng Hồ Chí Minh (SS003)\n*   Pháp luật đại cương (SS006)\n*   Triết học Mác – Lênin (SS007)\n*   Kinh tế chính trị Mác – Lênin (SS008)\n*   Chủ nghĩa xã hội khoa học (SS009)\n*   Lịch sử Đảng Cộng sản Việt Nam (SS010)\n*   Giáo dục thể chất 1 (PE231)\n*   Giáo dục thể chất 2 (PE232)\n*   Giáo dục quốc phòng (ME001)\n*   Anh văn 1 (ENG01)\n*   Anh văn 2 (ENG02)\n*   Anh văn 3 (ENG03)\n*   Toán-Tin học-Khoa học tự nhiên (MA003, MA005, IT001)\n*   Kỹ thuật phát triển hệ thống Web (IE213)\n*   Khai thác dữ liệu truyền thông xã hội (IE233)\n*   Phân tích và trực quan dữ liệu (IE212)\n*   Kỹ thuật lập trình Python (IE221)\n*   Thực tập (IE207)\n\n**Lưu ý:** Danh sách này dựa trên thông tin được cung cấp trong Context 0, Context 1, Context 2 và Context 3.",
      "contexts": [
        "[Chương trình Truyền Thông Đa Phương Tiện > Khối kiến thức giáo dục đại cương]\n\nTổng cộng 45 tín chỉ (không báo gồm giáo dục thể chất và giáo dục quốc phòng). Các môn đại cương được chia thành 5 nhóm gồm: Chính trị pháp luật (13 tín chỉ), Giáo dục thể chất và quốc phòng (không tính tín chỉ), Anh văn (12 tín chỉ), Toán – Tin học – Khoa học tự nhiên (10 tín chỉ), và Khoa học xã hội – Kinh tế - Quản lý (10 tín chỉ). Danh sách các môn trong khối kiến thức giáo dục đại cương được liệt kê trong Bảng 11.\n\nBảng 11: Bảng phân bổ các môn họctrong khối kiến thức đại cương\n\n| **TT**| **Mã MH**| **Tên môn học (MH)**<br><br>**Tiếng việt**<br><br>**Tiếng Anh**| **Loại MH**<br><br>**(bắt buộc / tự chọn)**| **Tín chỉ**|     |     | **Phòng TN**|     |     |\n| --- | --- | --- | --- | --- | --- | --- | --- | --- | --- |\n| **Tổng cộng**| **Lý thuyết**| **Thực hành / Thí nghiệm / Bài tập lớn**|     |     |     |\n| --- | --- | --- | --- | --- | --- | --- | --- | --- | --- |\n| **I**| **Kiến thức giáo dục đại cương**|     |     |     |     |     |     |     |     |\n|     |     | **Chính trị pháp luật (13 TC)**|     |     |     |     |     |     |     |\n| 1   | SS003 | Tư tưởng Hồ Chí Minh<br><br>Ho Chi Minh's ideology | bắt buộc | 2   | 2   | 0   |     |     |     |\n| 2   | SS006 | Pháp luật đại cương<br><br>Introduction to Law | bắt buộc | 2   | 2   | 0   |     |     |     |\n| 3   | SS007 | Triết học Mác – Lênin<br><br>Philosophy Marx-Lenin | bắt buộc | 3   | 3   | 0   |     |     |     |\n| 4   | SS008 | Kinh tế chính trị Mác – Lênin<br><br>Marxist Leninist political economy | bắt buộc | 2   | 2   | 0   |     |     |     |\n| 5   | SS009 | Chủ nghĩa xã hội khoa học<br><br>Scientific socialism | bắt buộc | 2   | 2   | 0   |     |     |     |\n| 6   | SS010 | Lịch sử Đảng Cộng sản Việt Nam<br><br>History of Vietnamese communist party | bắt buộc | 2   | 2   | 0   |     |     |     |\n|     |     | **Giáo dục thể chất – Giáo dục quốc phòng**|     |     |     |     |     |     |     |\n| 7   | PE231 | Giáo dục thể chất 1<br><br>Physical Education 1 | bắt buộc | Tính riêng |     |     |     |     |     |\n| 8   | PE232 | Giáo dục thể chất 2<br><br>Physical Education 2 | bắt buộc | Tính riêng |     |     |     |     |     |\n| 9   | ME001 | Giáo dục quốc phòng<br><br>National Defense and Security Education | bắt buộc | Tính riêng |     |     |     |     |     |\n|     |     | Ngoại ngữ (12 TC) |     |     |     |     |     |     |     |\n| 10  | ENG01 | Anh văn 1<br><br>English 1 | bắt buộc | 4   | 4   | 0   |     |     |     |\n| 11  | ENG02 | Anh văn 2<br><br>English 2 | bắt buộc | 4   | 4   | 0   |     |     |     |\n| 12  | ENG03 | Anh văn 3<br><br>English 3 | bắt buộc | 4   | 4   | 0   |     |     |     |\n|     |     | **Toán – Tin học – Khoa học tự nhiên (10 TC)**|     |     |     |     |     |     |     |\n| 13  | MA003 | Đại số tuyến tính<br><br>Linear algebra | bắt buộc | 3   | 3   | 0   |     |     |     |\n| 14  | MA005 | Xác suất thống kê<br><br>Statistical Probability | bắt buộc | 3   | 3   | 0   |     |     |     |\n| 15  | IT001 | Nhập môn Lập trình<br><br>Introduction to Programming | bắt buộc | 4   | 3   | 1   |     |     |     |\n|     |     | **Khoa học xã hội – Nghệ thuật - Kinh tế - Quản lý (10 TC)**|     |     |     |     |     |     |     |\n| 16  | MM005 | Nhập môn marketing  <br>Introduction to marketting | bắt buộc | 2   | 2   | 0   |     |     |     |\n| 17  | MM006 | Tâm lý học đại cương  <br>Introduction to psychology | bắt buộc | 2   | 2   | 0   |     |     |     |\n| 18  | MM007 | Tư duy sáng tạo và xu hướng thiết kế truyền thông  <br>Creative Thinking and Media Design Trends | bắt buộc | 2   | 2   | 0   |     |     |     |\n| 19  | MM008 | Kỹ năng truyền thông giao tiếp  <br>Communication Skills | bắt buộc | 2   | 2   | 0   |     |     |     |\n| 20  | SS004 | Kỹ năng nghề nghiệp  <br>Professional Skill | bắt buộc | 2   | 2   | 0   |     |     |     |\n|     |     |     |     |     |     |     |     |     |     |",
        "[Chương Trình Kỹ Thuật Phần Mềm > Tỷ lệ các khối kiến thức > Khối kiến thức tốt nghiệp]\n\nKhối kiến thức tốt nghiệp trang bị cho sinh viên khả năng vận dụng tổng hợp kiến thức và kỹ năng đã học để thực hiện các dự án thực tế, đồ án và khóa luận, chuẩn bị cho nghề nghiệp sau khi tốt nghiệp. Khối kiến thức này bao gồm các nhóm học phần chính như sau:\n\nThực tập\n\nSinh viên thực hiện Thực tập (2 TC) nhằm làm quen với môi trường làm việc thực tế, áp dụng kiến thức lập trình và quản lý phần mềm vào các dự án tại doanh nghiệp hoặc phòng thí nghiệm.\n\nNhóm các môn học đồ án\n\nNhóm này gồm Đồ án (2 TC), giúp sinh viên phát triển kỹ năng thực hành, giải quyết vấn đề và làm việc nhóm trên các dự án phần mềm cụ thể.\n\nKhóa luận tốt nghiệp\n\nSinh viên đủ điều kiện có thể đăng ký Khóa luận tốt nghiệp (10 TC) để thực hiện nghiên cứu chuyên sâu, phát triển đề tài cá nhân hoặc nhóm (tối đa 2 sinh viên/đề tài). Sinh viên không đủ điều kiện hoặc không đăng ký Khóa luận có thể thay thế bằng Đồ án tốt nghiệp tại doanh nghiệp (10 TC) hoặc kết hợp Đồ án tốt nghiệp (6 TC) với tối thiểu một môn trong các môn chuyên đề tốt nghiệp.\n\nĐồ án tốt nghiệp tại doanh nghiệp\n\nSinh viên có thể thực hiện Đồ án tốt nghiệp tại doanh nghiệp (10 TC) nhằm áp dụng kiến thức vào môi trường thực tế, tiếp cận quy trình phát triển phần mềm chuyên nghiệp và nâng cao kỹ năng nghề nghiệp. Nếu không thực hiện môn này, sinh viên có thể kết hợp Đồ án tốt nghiệp (6 TC) với ít nhất một môn chuyên đề tốt nghiệp.\n\nNhóm gồm Đồ án tốt nghiệp và các môn học chuyên đề tốt nghiệp\n\nNhóm này yêu cầu sinh viên học Đồ án tốt nghiệp (6 TC, bắt buộc) và tối thiểu một trong các môn chuyên đề tốt nghiệp, giúp nâng cao năng lực thiết kế, phát triển phần mềm, và tiếp cận các công nghệ hiện đại.",
        "[Chương trình An Toàn Thông Tin > Kế hoạch giảng dạy mẫu > Học kỳ 1]\n\n---\n\n[Bảng 1] Bảng 8 hàng x 5 cột. Các cột: Mã môn học, Tên môn học, TC, ...\n: Mã môn học, : Tên môn học, : TC, : LT, : TH/BT\nMã môn học: IT001, Tên môn học: Nhập môn lập trình, TC: 4, LT: 3, TH/BT: 1\nMã môn học: MA006, Tên môn học: Giải tích, TC: 4, LT: 4, TH/BT: 0\nMã môn học: MA003, Tên môn học: Đại số tuyến tính, TC: 3, LT: 3, TH/BT: 0\nMã môn học: PH002, Tên môn học: Nhập môn mạch số, TC: 4, LT: 3, TH/BT: 1\nMã môn học: NT015, Tên môn học: Giới thiệu ngành ATTT, TC: 1, LT: 1, TH/BT: 0\nMã môn học: ENG01, Tên môn học: Anh văn 1, TC: 4, LT: 4, TH/BT: 0\nMã môn học: ME001, Tên môn học: Giáo dục quốc phòng, TC: Tính riêng\nMã môn học: Tổng, Tên môn học: Tổng tín chỉ học kỳ 1, TC: 20, LT: 18, TH/BT: 2",
        "[Ngành Công Nghệ Thông Tin > Các khối kiến thức]\n\nKhông kể giáo dục thể chất và giáo dục quốc phòng.\n\n**(10TC)** | Chọn 1 trong 3 hình thức sau (\\*\\*): | | | 8 |\n\n**Lưu ý:**\n\n\\- (\\*) Sinh viên chọn các môn chuyên ngành theo hướng dẫn tại mục 3.4.2.\n\n\\- (\\*\\*) Sinh viên chọn hình thức tốt nghiệp theo hướng dẫn tại mục 3.5.\n\n[Bảng 1] Bảng 8 hàng x 5 cột. Các cột: Khối kiến thức, , , ...\n: Khối kiến thức, : Khối lượng\nKhối lượng: Tổng số tín chỉ, : %\nKhối kiến thức: Khối kiến thức giáo dục đại cương**(45 TC)**, : Lý luận chính trị và pháp luật, Khối lượng: 13, : 36\n: Toán-Tin học-Khoa học tự nhiên, Khối lượng: 18\n: Ngoại ngữ, Khối lượng: 12\n: Giáo dục thể chất – Giáo dục Quốc phòng, Khối lượng: Tính riêng\n: Các môn học khác, Khối lượng: 2\nKhối kiến thức: Khối kiến thức giáo dục chuyên nghiệp (70TC), : Cơ sở ngành, Khối lượng: 44, : 56\n: Chuyên ngành (*), Khối lượng: ³ 26",
        "[Ngành Công Nghệ Thông Tin > Các khối kiến thức > Khối kiến thức giáo dục chuyên nghiệp > Nhóm các môn học chuyên ngành]\n\n**Bắt buộc** đối với sinh viên ngành Công nghệ thông tin (**Tối thiểu 26 tín chỉ**).\n\nSinh viên được chọn môn học chuyên ngành tự do sao cho **tổng số tín chỉ ³26.**&#x54;rong đó, sinh viên phải học các môn học thuộc danh mục 3.4.2.3 để **tích lũy tối thiểu 6 tín chỉ và tối đa 10 tín chỉ.**&#x43;ác môn học chuyên ngành bao gồm 02 hướng có vai trò như nhau, trong đó có một số môn thuộc 01 hướng sẽ được gom cụm. (Sinh viên có thể chọn các môn học thuộc cả 02 hướng, không nhất thiết cố định 01 hướng).\n\n1. **Hướng Truyền thông xã hội và công nghệ Web**\n\n2. **Hướng Khoa học thông tin**\n\n3. **Tự chọn tự do**\n\nTổng số tín chỉ cho các môn tự chọn tự do là tối thiểu 6 tín chỉvàtối đa10 tín chỉ.\n\nNgoài các môn học tự chọn trong danh sách bên dưới, sinh viên có thể chọn học:\n\n· Các môn học chuyên ngành (các môn học thuộc mục 3.4.2.1 đến 3.4.2.2), nếu các môn học này chưa được tính trong khối kiến thức chuyên ngành.\n\n· Hoặc, các môn học thuộc khối kiến thức giáo dục chuyên nghiệp trong các chương trình đào tạo đại học hoặc sau đại học của Trường ĐHCNTT hoặc của các Trường đại học khác trong ĐHQG –HCM hoặc của các Trường khác ngoài ĐHQG – HCM mà có ký kết hợp tác với Trường ĐH CNTT. Các môn học tương đương nhau chỉ được tính một lần vào tổng số tín chỉ tích lũy.\n\nDanh sách môn tự chọn tự do gợi ý:\n\n[Bảng 1] Bảng 12 hàng x 6 cột. Các cột: STT, Mã môn, Tên môn, ...\n: STT, : Mã môn, : Tên môn, : TC, : LT, : TH\nSTT: 1., Mã môn: IE213, Tên môn: Kỹ thuật phát triển hệ thống Web, TC: 4, LT: 3, TH: 1\nSTT: 2., Mã môn: IE307, Tên môn: Công nghệ lập trình đa nền tảng cho ứng dụng di động, TC: 4, LT: 3, TH: 1\nSTT: 3., Mã môn: IE233, Tên môn: Phân tích và mô hình mạng xã hội, TC: 4, LT: 3, TH: 1\nSTT: 4., Mã môn: IE403, Tên môn: Khai thác dữ liệu truyền thông xã hội, TC: 3, LT: 3, TH: 0\nSTT: 5., Mã môn: DS300, Tên môn: Hệ khuyến nghị, TC: 4, LT: 3, TH: 1\nSTT: 6., Mã môn: IE203, Tên môn: Hệ thống quản trị qui trình nghiệp vụ, TC: 4, LT: 3, TH: 1\nSTT: 7., Mã môn: IE204, Tên môn: Tối ưu hóa công cụ tìm kiếm (SEO), TC: 4, LT: 3, TH: 1\nSTT: 8., Mã môn: IE303, Tên môn: Công nghệ Java, TC: 4, LT: 3, TH: 1\nSTT: 9., Mã môn: IE310, Tên môn: Tư duy thiết kế, TC: 3, LT: 3, TH: 0\nSTT: 10., Mã môn: IE301, Tên môn: Quản trị quan hệ khách hàng, TC: 3, LT: 3, TH: 0\nSTT: 11., Mã môn: DS322, Tên môn: Thiết kế hệ thống học máy, TC: 4, LT: 3, TH: 1\nSTT: Và các môn học khác theo đề nghị của Khoa\n[Bảng 2] Bảng 12 hàng x 6 cột. Các cột: STT, Mã môn, Tên môn, ...\n: STT, : Mã môn, : Tên môn, : TC, : LT, : TH\nSTT: 1., Mã môn: IE201, Tên môn: Xử lý dữ liệu thống kê, TC: 3, LT: 3, TH: 0\nSTT: 2., Mã môn: IE221, Tên môn: Kỹ thuật lập trình Python, TC: 4, LT: 3, TH: 1\nSTT: 3., Mã môn: DS108, Tên môn: Tiền xử lý và xây dựng bộ dữ liệu, TC: 4, LT: 3, TH: 1\nSTT: 4., Mã môn: IE313, Tên môn: Phân tích và trực quan dữ liệu, TC: 4, LT: 3, TH: 1\nSTT: 5., Mã môn: IE212, Tên môn: Công nghệ Dữ liệu lớn, TC: 4, LT: 3, TH: 1\nSTT: 6., Mã môn: IE302, Tên môn: Kiến trúc và tích hợp hệ thống, TC: 3, LT: 3, TH: 0\nSTT: 7., Mã môn: IE402, Tên môn: Hệ thống thông tin địa lý 3 chiều, TC: 4, LT: 3, TH: 1\nSTT: 8., Mã môn: DS307, Tên môn: Phân tích dữ liệu truyền thông xã hội, TC: 3, LT: 3, TH: 0\nSTT: 9., Mã môn: DS317, Tên môn: Khai phá dữ liệu trong doanh nghiệp, TC: 4, LT: 3, TH: 1\nSTT: 10., Mã môn: IE102, Tên môn: Các công nghệ nền, TC: 3, LT: 2, TH: 1\nSTT: 11., Mã môn: IE231, Tên môn: Quản trị doanh nghiệp công nghệ thông tin, TC: 3, LT: 3, TH: 0\nSTT: Và các môn học khác theo đề nghị của Khoa\n[Bảng 3] Bảng 10 hàng x 6 cột. Các cột: STT, Mã môn, Tên môn, ...\n: STT, : Mã môn, : Tên môn, : TC, : LT, : TH\nSTT: 1., Mã môn: BUS1125, Tên môn: Khởi nghiệp kinh doanh, TC: 3, LT: 2, TH: 1\nSTT: 2., Mã môn: TLH025, Tên môn: Tâm lý học nhân cách, TC: 3, LT: 3, TH: 0\nSTT: 3., Mã môn: INI01, Tên môn: Thực tập quốc tế, TC: 2, LT: 2, TH: 0\nSTT: 4., Mã môn: IE207, Tên môn: Đồ án, TC: 2, LT: 0, TH: 2\nSTT: 5., Mã môn: IE309, Tên môn: Thực tập doanh nghiệp, TC: 2, LT: 2, TH: 0\nSTT: 6., Mã môn: DS323, Tên môn: Viết báo cáo kỹ thuật và thuyết trình, TC: 3, LT: 3, TH: 0\nSTT: 7., Mã môn: SE113, Tên môn: Kiểm chứng phần mềm (Có môn học trước), TC: 4, LT: 3, TH: 1\nSTT: 8., Mã môn: NT212, Tên môn: An toàn dữ liệu, khôi phục thông tin sau sự cố (Có môn học trước), TC: 3, LT: 2, TH: 1\nSTT: 9., Mã môn: NT213, Tên môn: Bảo mật web và ứng dụng (Có môn học trước), TC: 3, LT: 2, TH: 1\nSTT: Và các môn học khác theo đề nghị của Khoa"
      ],
      "ground_truth": "",
      "expected_intent": "roadmap",
      "metadata": {
        "major_used": null,
        "chunks_retrieved": 0,
        "sections_retrieved": 5,
        "total_time_ms": 31601.37963294983
      },
      "sources": [
        {
          "section_id": "4dfe24874fd5",
          "title": "Khối kiến thức giáo dục đại cương",
          "hierarchy_path": "Chương trình Truyền Thông Đa Phương Tiện > Khối kiến thức giáo dục đại cương",
          "text_preview": "[Chương trình Truyền Thông Đa Phương Tiện > Khối kiến thức giáo dục đại cương]\n\nTổng cộng 45 tín chỉ (không báo gồm giáo dục thể chất và giáo dục quốc phòng). Các môn đại cương được chia thành 5 nhóm gồm: Chính trị pháp luật (13 tín chỉ), Giáo dục thể chất và quốc phòng (không tính tín chỉ), Anh văn (12 tín chỉ), Toán – Tin học – Khoa học tự nhiên (10 tín chỉ), và Khoa học xã hội – Kinh tế - Quản lý (10 tín chỉ). Danh sách các môn trong khối kiến thức giáo dục đại cương được liệt kê trong Bảng 11.\n\nBảng 11: Bảng phân bổ các môn họctrong khối kiến thức đại cương\n\n| **TT**| **Mã MH**| **Tên môn học (MH)**<br><br>**Tiếng việt**<br><br>**Tiếng Anh**| **Loại MH**<br><br>**(bắt buộc / tự chọn)**| **Tín chỉ**|     |     | **Phòng TN**|     |     |\n| --- | --- | --- | --- | --- | --- | --- | --- | --- | --- |\n| **Tổng cộng**| **Lý thuyết**| **Thực hành / Thí nghiệm / Bài tập lớn**|     |     |     |\n| --- | --- | --- | --- | --- | --- | --- | --- | --- | --- |\n| **I**| **Kiến thức giáo dục đại cương**|     |     |     |     |     |     |     |     |\n|     |     | **Chính trị pháp luật (13 TC)**|     |     |     |     |     |     |     |\n| 1   | SS003 | Tư tưởng Hồ Chí Minh<br><br>Ho Chi Minh's ideology | bắt buộc | 2   | 2   | 0   |     |     |     |\n| 2   | SS006 | Pháp luật đại cương<br><br>Introduction to Law | bắt buộc | 2   | 2   | 0   |     |     |     |\n| 3   | SS007 | Triết học Mác – Lênin<br><br>Philosophy Marx-Lenin | bắt buộc | 3   | 3   | 0   |     |     |     |\n| 4   | SS008 | Kinh tế chính trị Mác – Lênin<br><br>Marxist Leninist political economy | bắt buộc | 2   | 2   | 0   |     |     |     |\n| 5   | SS009 | Chủ nghĩa xã hội khoa học<br><br>Scientific socialism | bắt buộc | 2   | 2   | 0   |     |     |     |\n| 6   | SS010 | Lịch sử Đảng Cộng sản Việt Nam<br><br>History of Vietnamese communist party | bắt buộc | 2   | 2   | 0   |     |     |     |\n|     |     | **Giáo dục thể chất – Giáo dục quốc phòng**|     |     |     |     |     |     |     |\n| 7   | PE231 | Giáo dục thể chất 1<br><br>Physical Education 1 | bắt buộc | Tính riêng |     |     |     |     |     |\n| 8   | PE232 | Giáo dục thể chất 2<br><br>Physical Education 2 | bắt buộc | Tính riêng |     |     |     |     |     |\n| 9   | ME001 | Giáo dục quốc phòng<br><br>National Defense and Security Education | bắt buộc | Tính riêng |     |     |     |     |     |\n|     |     | Ngoại ngữ (12 TC) |     |     |     |     |     |     |     |\n| 10  | ENG01 | Anh văn 1<br><br>English 1 | bắt buộc | 4   | 4   | 0   |     |     |     |\n| 11  | ENG02 | Anh văn 2<br><br>English 2 | bắt buộc | 4   | 4   | 0   |     |     |     |\n| 12  | ENG03 | Anh văn 3<br><br>English 3 | bắt buộc | 4   | 4   | 0   |     |     |     |\n|     |     | **Toán – Tin học – Khoa học tự nhiên (10 TC)**|     |     |     |     |     |     |     |\n| 13  | MA003 | Đại số tuyến tính<br><br>Linear algebra | bắt buộc | 3   | 3   | 0   |     |     |     |\n| 14  | MA005 | Xác suất thống kê<br><br>Statistical Probability | bắt buộc | 3   | 3   | 0   |     |     |     |\n| 15  | IT001 | Nhập môn Lập trình<br><br>Introduction to Programming | bắt buộc | 4   | 3   | 1   |     |     |     |\n|     |     | **Khoa học xã hội – Nghệ thuật - Kinh tế - Quản lý (10 TC)**|     |     |     |     |     |     |     |\n| 16  | MM005 | Nhập môn marketing  <br>Introduction to marketting | bắt buộc | 2   | 2   | 0   |     |     |     |\n| 17  | MM006 | Tâm lý học đại cương  <br>Introduction to psychology | bắt buộc | 2   | 2   | 0   |     |     |     |\n| 18  | MM007 | Tư duy sáng tạo và xu hướng thiết kế truyền thông  <br>Creative Thinking and Media Design Trends | bắt buộc | 2   | 2   | 0   |     |     |     |\n| 19  | MM008 | Kỹ năng truyền thông giao tiếp  <br>Communication Skills | bắt buộc | 2   | 2   | 0   |     |     |     |\n| 20  | SS004 | Kỹ năng nghề nghiệp  <br>Professional Skill | bắt buộc | 2   | 2   | 0   |     |     |     |\n|     |     |     |     |     |     |     |     |     |     |",
          "score": 0.04858621
        },
        {
          "section_id": "c3cf6058086e",
          "title": "Khối kiến thức tốt nghiệp",
          "hierarchy_path": "Chương Trình Kỹ Thuật Phần Mềm > Tỷ lệ các khối kiến thức > Khối kiến thức tốt nghiệp",
          "text_preview": "[Chương Trình Kỹ Thuật Phần Mềm > Tỷ lệ các khối kiến thức > Khối kiến thức tốt nghiệp]\n\nKhối kiến thức tốt nghiệp trang bị cho sinh viên khả năng vận dụng tổng hợp kiến thức và kỹ năng đã học để thực hiện các dự án thực tế, đồ án và khóa luận, chuẩn bị cho nghề nghiệp sau khi tốt nghiệp. Khối kiến thức này bao gồm các nhóm học phần chính như sau:\n\nThực tập\n\nSinh viên thực hiện Thực tập (2 TC) nhằm làm quen với môi trường làm việc thực tế, áp dụng kiến thức lập trình và quản lý phần mềm vào các dự án tại doanh nghiệp hoặc phòng thí nghiệm.\n\nNhóm các môn học đồ án\n\nNhóm này gồm Đồ án (2 TC), giúp sinh viên phát triển kỹ năng thực hành, giải quyết vấn đề và làm việc nhóm trên các dự án phần mềm cụ thể.\n\nKhóa luận tốt nghiệp\n\nSinh viên đủ điều kiện có thể đăng ký Khóa luận tốt nghiệp (10 TC) để thực hiện nghiên cứu chuyên sâu, phát triển đề tài cá nhân hoặc nhóm (tối đa 2 sinh viên/đề tài). Sinh viên không đủ điều kiện hoặc không đăng ký Khóa luận có thể thay thế bằng Đồ án tốt nghiệp tại doanh nghiệp (10 TC) hoặc kết hợp Đồ án tốt nghiệp (6 TC) với tối thiểu một môn trong các môn chuyên đề tốt nghiệp.\n\nĐồ án tốt nghiệp tại doanh nghiệp\n\nSinh viên có thể thực hiện Đồ án tốt nghiệp tại doanh nghiệp (10 TC) nhằm áp dụng kiến thức vào môi trường thực tế, tiếp cận quy trình phát triển phần mềm chuyên nghiệp và nâng cao kỹ năng nghề nghiệp. Nếu không thực hiện môn này, sinh viên có thể kết hợp Đồ án tốt nghiệp (6 TC) với ít nhất một môn chuyên đề tốt nghiệp.\n\nNhóm gồm Đồ án tốt nghiệp và các môn học chuyên đề tốt nghiệp\n\nNhóm này yêu cầu sinh viên học Đồ án tốt nghiệp (6 TC, bắt buộc) và tối thiểu một trong các môn chuyên đề tốt nghiệp, giúp nâng cao năng lực thiết kế, phát triển phần mềm, và tiếp cận các công nghệ hiện đại.",
          "score": 0.015543648
        },
        {
          "section_id": "ee8a9cf0b85c",
          "title": "Học kỳ 1",
          "hierarchy_path": "Chương trình An Toàn Thông Tin > Kế hoạch giảng dạy mẫu > Học kỳ 1",
          "text_preview": "[Chương trình An Toàn Thông Tin > Kế hoạch giảng dạy mẫu > Học kỳ 1]\n\n---\n\n[Bảng 1] Bảng 8 hàng x 5 cột. Các cột: Mã môn học, Tên môn học, TC, ...\n: Mã môn học, : Tên môn học, : TC, : LT, : TH/BT\nMã môn học: IT001, Tên môn học: Nhập môn lập trình, TC: 4, LT: 3, TH/BT: 1\nMã môn học: MA006, Tên môn học: Giải tích, TC: 4, LT: 4, TH/BT: 0\nMã môn học: MA003, Tên môn học: Đại số tuyến tính, TC: 3, LT: 3, TH/BT: 0\nMã môn học: PH002, Tên môn học: Nhập môn mạch số, TC: 4, LT: 3, TH/BT: 1\nMã môn học: NT015, Tên môn học: Giới thiệu ngành ATTT, TC: 1, LT: 1, TH/BT: 0\nMã môn học: ENG01, Tên môn học: Anh văn 1, TC: 4, LT: 4, TH/BT: 0\nMã môn học: ME001, Tên môn học: Giáo dục quốc phòng, TC: Tính riêng\nMã môn học: Tổng, Tên môn học: Tổng tín chỉ học kỳ 1, TC: 20, LT: 18, TH/BT: 2",
          "score": 0.012722708
        },
        {
          "section_id": "4d3fa15f8c8e",
          "title": "Các khối kiến thức",
          "hierarchy_path": "Ngành Công Nghệ Thông Tin > Các khối kiến thức",
          "text_preview": "[Ngành Công Nghệ Thông Tin > Các khối kiến thức]\n\nKhông kể giáo dục thể chất và giáo dục quốc phòng.\n\n**(10TC)** | Chọn 1 trong 3 hình thức sau (\\*\\*): | | | 8 |\n\n**Lưu ý:**\n\n\\- (\\*) Sinh viên chọn các môn chuyên ngành theo hướng dẫn tại mục 3.4.2.\n\n\\- (\\*\\*) Sinh viên chọn hình thức tốt nghiệp theo hướng dẫn tại mục 3.5.\n\n[Bảng 1] Bảng 8 hàng x 5 cột. Các cột: Khối kiến thức, , , ...\n: Khối kiến thức, : Khối lượng\nKhối lượng: Tổng số tín chỉ, : %\nKhối kiến thức: Khối kiến thức giáo dục đại cương**(45 TC)**, : Lý luận chính trị và pháp luật, Khối lượng: 13, : 36\n: Toán-Tin học-Khoa học tự nhiên, Khối lượng: 18\n: Ngoại ngữ, Khối lượng: 12\n: Giáo dục thể chất – Giáo dục Quốc phòng, Khối lượng: Tính riêng\n: Các môn học khác, Khối lượng: 2\nKhối kiến thức: Khối kiến thức giáo dục chuyên nghiệp (70TC), : Cơ sở ngành, Khối lượng: 44, : 56\n: Chuyên ngành (*), Khối lượng: ³ 26",
          "score": 0.008610767
        },
        {
          "section_id": "40be15102e72",
          "title": "Nhóm các môn học chuyên ngành",
          "hierarchy_path": "Ngành Công Nghệ Thông Tin > Các khối kiến thức > Khối kiến thức giáo dục chuyên nghiệp > Nhóm các môn học chuyên ngành",
          "text_preview": "[Ngành Công Nghệ Thông Tin > Các khối kiến thức > Khối kiến thức giáo dục chuyên nghiệp > Nhóm các môn học chuyên ngành]\n\n**Bắt buộc** đối với sinh viên ngành Công nghệ thông tin (**Tối thiểu 26 tín chỉ**).\n\nSinh viên được chọn môn học chuyên ngành tự do sao cho **tổng số tín chỉ ³26.**&#x54;rong đó, sinh viên phải học các môn học thuộc danh mục 3.4.2.3 để **tích lũy tối thiểu 6 tín chỉ và tối đa 10 tín chỉ.**&#x43;ác môn học chuyên ngành bao gồm 02 hướng có vai trò như nhau, trong đó có một số môn thuộc 01 hướng sẽ được gom cụm. (Sinh viên có thể chọn các môn học thuộc cả 02 hướng, không nhất thiết cố định 01 hướng).\n\n1. **Hướng Truyền thông xã hội và công nghệ Web**\n\n2. **Hướng Khoa học thông tin**\n\n3. **Tự chọn tự do**\n\nTổng số tín chỉ cho các môn tự chọn tự do là tối thiểu 6 tín chỉvàtối đa10 tín chỉ.\n\nNgoài các môn học tự chọn trong danh sách bên dưới, sinh viên có thể chọn học:\n\n· Các môn học chuyên ngành (các môn học thuộc mục 3.4.2.1 đến 3.4.2.2), nếu các môn học này chưa được tính trong khối kiến thức chuyên ngành.\n\n· Hoặc, các môn học thuộc khối kiến thức giáo dục chuyên nghiệp trong các chương trình đào tạo đại học hoặc sau đại học của Trường ĐHCNTT hoặc của các Trường đại học khác trong ĐHQG –HCM hoặc của các Trường khác ngoài ĐHQG – HCM mà có ký kết hợp tác với Trường ĐH CNTT. Các môn học tương đương nhau chỉ được tính một lần vào tổng số tín chỉ tích lũy.\n\nDanh sách môn tự chọn tự do gợi ý:\n\n[Bảng 1] Bảng 12 hàng x 6 cột. Các cột: STT, Mã môn, Tên môn, ...\n: STT, : Mã môn, : Tên môn, : TC, : LT, : TH\nSTT: 1., Mã môn: IE213, Tên môn: Kỹ thuật phát triển hệ thống Web, TC: 4, LT: 3, TH: 1\nSTT: 2., Mã môn: IE307, Tên môn: Công nghệ lập trình đa nền tảng cho ứng dụng di động, TC: 4, LT: 3, TH: 1\nSTT: 3., Mã môn: IE233, Tên môn: Phân tích và mô hình mạng xã hội, TC: 4, LT: 3, TH: 1\nSTT: 4., Mã môn: IE403, Tên môn: Khai thác dữ liệu truyền thông xã hội, TC: 3, LT: 3, TH: 0\nSTT: 5., Mã môn: DS300, Tên môn: Hệ khuyến nghị, TC: 4, LT: 3, TH: 1\nSTT: 6., Mã môn: IE203, Tên môn: Hệ thống quản trị qui trình nghiệp vụ, TC: 4, LT: 3, TH: 1\nSTT: 7., Mã môn: IE204, Tên môn: Tối ưu hóa công cụ tìm kiếm (SEO), TC: 4, LT: 3, TH: 1\nSTT: 8., Mã môn: IE303, Tên môn: Công nghệ Java, TC: 4, LT: 3, TH: 1\nSTT: 9., Mã môn: IE310, Tên môn: Tư duy thiết kế, TC: 3, LT: 3, TH: 0\nSTT: 10., Mã môn: IE301, Tên môn: Quản trị quan hệ khách hàng, TC: 3, LT: 3, TH: 0\nSTT: 11., Mã môn: DS322, Tên môn: Thiết kế hệ thống học máy, TC: 4, LT: 3, TH: 1\nSTT: Và các môn học khác theo đề nghị của Khoa\n[Bảng 2] Bảng 12 hàng x 6 cột. Các cột: STT, Mã môn, Tên môn, ...\n: STT, : Mã môn, : Tên môn, : TC, : LT, : TH\nSTT: 1., Mã môn: IE201, Tên môn: Xử lý dữ liệu thống kê, TC: 3, LT: 3, TH: 0\nSTT: 2., Mã môn: IE221, Tên môn: Kỹ thuật lập trình Python, TC: 4, LT: 3, TH: 1\nSTT: 3., Mã môn: DS108, Tên môn: Tiền xử lý và xây dựng bộ dữ liệu, TC: 4, LT: 3, TH: 1\nSTT: 4., Mã môn: IE313, Tên môn: Phân tích và trực quan dữ liệu, TC: 4, LT: 3, TH: 1\nSTT: 5., Mã môn: IE212, Tên môn: Công nghệ Dữ liệu lớn, TC: 4, LT: 3, TH: 1\nSTT: 6., Mã môn: IE302, Tên môn: Kiến trúc và tích hợp hệ thống, TC: 3, LT: 3, TH: 0\nSTT: 7., Mã môn: IE402, Tên môn: Hệ thống thông tin địa lý 3 chiều, TC: 4, LT: 3, TH: 1\nSTT: 8., Mã môn: DS307, Tên môn: Phân tích dữ liệu truyền thông xã hội, TC: 3, LT: 3, TH: 0\nSTT: 9., Mã môn: DS317, Tên môn: Khai phá dữ liệu trong doanh nghiệp, TC: 4, LT: 3, TH: 1\nSTT: 10., Mã môn: IE102, Tên môn: Các công nghệ nền, TC: 3, LT: 2, TH: 1\nSTT: 11., Mã môn: IE231, Tên môn: Quản trị doanh nghiệp công nghệ thông tin, TC: 3, LT: 3, TH: 0\nSTT: Và các môn học khác theo đề nghị của Khoa\n[Bảng 3] Bảng 10 hàng x 6 cột. Các cột: STT, Mã môn, Tên môn, ...\n: STT, : Mã môn, : Tên môn, : TC, : LT, : TH\nSTT: 1., Mã môn: BUS1125, Tên môn: Khởi nghiệp kinh doanh, TC: 3, LT: 2, TH: 1\nSTT: 2., Mã môn: TLH025, Tên môn: Tâm lý học nhân cách, TC: 3, LT: 3, TH: 0\nSTT: 3., Mã môn: INI01, Tên môn: Thực tập quốc tế, TC: 2, LT: 2, TH: 0\nSTT: 4., Mã môn: IE207, Tên môn: Đồ án, TC: 2, LT: 0, TH: 2\nSTT: 5., Mã môn: IE309, Tên môn: Thực tập doanh nghiệp, TC: 2, LT: 2, TH: 0\nSTT: 6., Mã môn: DS323, Tên môn: Viết báo cáo kỹ thuật và thuyết trình, TC: 3, LT: 3, TH: 0\nSTT: 7., Mã môn: SE113, Tên môn: Kiểm chứng phần mềm (Có môn học trước), TC: 4, LT: 3, TH: 1\nSTT: 8., Mã môn: NT212, Tên môn: An toàn dữ liệu, khôi phục thông tin sau sự cố (Có môn học trước), TC: 3, LT: 2, TH: 1\nSTT: 9., Mã môn: NT213, Tên môn: Bảo mật web và ứng dụng (Có môn học trước), TC: 3, LT: 2, TH: 1\nSTT: Và các môn học khác theo đề nghị của Khoa",
          "score": 0.0038844766
        }
      ]
    },
    {
      "question": "Học kỳ 6 ngành CNTT học những môn gì?",
      "answer": "Dựa trên thông tin được cung cấp, học kỳ 6 ngành Công Nghệ Thông Tin bao gồm các môn sau:\n\n*   Lịch sử Đảng Cộng sản Việt Nam (Mã môn: SS010)\n*   Nhập môn bảo đảm và an ninh thông tin (Mã môn: IE105)\n*   Phân tích thiết kế phần mềm (Mã môn: IE108)\n*   Các môn học chuyên ngành (TC ≥ 10)\n*   Tổng số tín chỉ HK6 (TC ≥ 16)\n\nNgoài ra, sinh viên có thể lựa chọn các môn sau:\n\n*   Cơ chế hoạt động của mã độc (Mã môn học: NT230)\n*   Đồ án chuyên ngành (Mã môn học: NT114)\n*   Môn tự chọn 1 (TC: 3, LT: 2, TH/BT: 1)\n*   Môn tự chọn 2 (TC: 3, LT: 2, TH/BT: 1)\n*   Kỹ thuật phát triển hệ thống Web (Mã môn: IE213)\n*   Công nghệ lập trình đa nền tảng cho ứng dụng di động (Mã môn: IE307)\n*   Phân tích và mô hình mạng xã hội (Mã môn: IE233)\n*   Khai thác dữ liệu truyền thông xã hội (Mã môn: IE403)\n*   Hệ khuyến nghị (Mã môn: DS300)\n*   Tối ưu hóa công cụ tìm kiếm (SEO) (Mã môn: IE204)\n*   Quản trị quan hệ khách hàng (CRM) (Mã môn: IE201)\n*   Xử lý dữ liệu thống kê (Mã môn: IE221)\n*   Kỹ thuật lập trình Python (Mã môn: DS108)\n*   Phân tích và trực quan dữ liệu (Mã môn: IE313)\n*   Kiến trúc và tích hợp hệ thống (Mã môn: IE212)\n*   Các môn khác theo đề nghị của Khoa.",
      "contexts": [
        "[Ngành Công Nghệ Thông Tin > Kế hoạch giảng dạy mẫu > Học kì 6]\n\n\n\n[Bảng 1] Bảng 6 hàng x 5 cột. Các cột: Mã môn, Tên môn học, TC, ...\n: Mã môn, : Tên môn học, : TC, : LT, : TH\nMã môn: SS010, Tên môn học: Lịch sử Đảng Cộng sản Việt Nam, TC: 2, LT: 2, TH: 0\nMã môn: IE105, Tên môn học: Nhập môn bảo đảm và an ninh thông tin, TC: 4, LT: 3, TH: 1\nMã môn: IE108, Tên môn học: Phân tích thiết kế phần mềm, TC: 4, LT: 3, TH: 1\nMã môn: PE232, Tên môn học: Giáo dục thể chất 2, TC: Tính riêng\nTên môn học: Các môn học chuyên ngành (**), TC: ≥ 10\nTên môn học: Tổng số tín chỉ HK6, TC: ≥ 16",
        "[Chương trình An Toàn Thông Tin > Kế hoạch giảng dạy mẫu > Học kỳ 6]\n\n---\n\n[Bảng 1] Bảng 7 hàng x 5 cột. Các cột: Mã môn học, Tên môn học, TC, ...\n: Mã môn học, : Tên môn học, : TC, : LT, : TH/BT\nMã môn học: NT230, Tên môn học: Cơ chế hoạt động của mã độc, TC: 3, LT: 2, TH/BT: 1\nMã môn học: SS003, Tên môn học: Tư tưởng Hồ Chí Minh, TC: 2, LT: 2, TH/BT: 0\nMã môn học: NT114, Tên môn học: Đồ án chuyên ngành, TC: 2, LT: 0, TH/BT: 2\nTên môn học: Môn chuyên ngành 2, TC: 3, LT: 2, TH/BT: 1\nTên môn học: Môn chuyên ngành 3, TC: 3, LT: 2, TH/BT: 1\nTên môn học: Môn tự chọn 1, TC: 3, LT: 2, TH/BT: 1\nMã môn học: Tổng, Tên môn học: Tổng tín chỉ học kỳ 6, TC: 16, LT: 10, TH/BT: 6",
        "[Ngành Công Nghệ Thông Tin > Kế hoạch giảng dạy mẫu > Học kì 7]\n\n\n\n[Bảng 1] Bảng 4 hàng x 6 cột. Các cột: Mã môn, Tên môn học, TC, ...\n: Mã môn, : Tên môn học, : TC, : LT, : TH\nMã môn: IE400, Tên môn học: Chuyên đề tốt nghiệp (***)(Bắt buộc nếu chọn hình thức 2 ở khối kiến thức tốt nghiệp), TC: 4, LT: 4, : 0\nTên môn học: Các môn học chuyên ngành (**), TC: ≥1 2\nTên môn học: Tổng số tín chỉ HK7- Nếu không tính Chuyên đề tốt nghiệp: ≥&#xA0;&#x31;2 TC- Nếu tính Chuyên đề tốt nghiệp: ≥&#x31;6 TC, TC: ≥ 12 - 16",
        "[Ngành Công Nghệ Thông Tin > Kế hoạch giảng dạy mẫu > Học kì 2]\n\n\n\n[Bảng 1] Bảng 6 hàng x 5 cột. Các cột: Mã môn, Tên môn học, TC, ...\n: Mã môn, : Tên môn học, : TC, : LT, : TH\nMã môn: IT002, Tên môn học: Lập trình hướng đối tượng, TC: 4, LT: 3, TH: 1\nMã môn: IT003, Tên môn học: Cấu trúc dữ liệu và giải thuật, TC: 4, LT: 3, TH: 1\nMã môn: SS004, Tên môn học: Kỹ năng nghề nghiệp, TC: 2, LT: 2, TH: 0\nMã môn: MA004, Tên môn học: Cấu trúc rời rạc, TC: 4, LT: 4, TH: 0\nMã môn: ENG02, Tên môn học: Anh văn 2 (*), TC: 4, LT: 4, TH: 0\nTên môn học: Tổng số tín chỉ HK2, TC: 18",
        "[Ngành Công Nghệ Thông Tin > Các khối kiến thức > Khối kiến thức giáo dục chuyên nghiệp > Nhóm các môn học chuyên ngành]\n\n**Bắt buộc** đối với sinh viên ngành Công nghệ thông tin (**Tối thiểu 26 tín chỉ**).\n\nSinh viên được chọn môn học chuyên ngành tự do sao cho **tổng số tín chỉ ³26.**&#x54;rong đó, sinh viên phải học các môn học thuộc danh mục 3.4.2.3 để **tích lũy tối thiểu 6 tín chỉ và tối đa 10 tín chỉ.**&#x43;ác môn học chuyên ngành bao gồm 02 hướng có vai trò như nhau, trong đó có một số môn thuộc 01 hướng sẽ được gom cụm. (Sinh viên có thể chọn các môn học thuộc cả 02 hướng, không nhất thiết cố định 01 hướng).\n\n1. **Hướng Truyền thông xã hội và công nghệ Web**\n\n2. **Hướng Khoa học thông tin**\n\n3. **Tự chọn tự do**\n\nTổng số tín chỉ cho các môn tự chọn tự do là tối thiểu 6 tín chỉvàtối đa10 tín chỉ.\n\nNgoài các môn học tự chọn trong danh sách bên dưới, sinh viên có thể chọn học:\n\n· Các môn học chuyên ngành (các môn học thuộc mục 3.4.2.1 đến 3.4.2.2), nếu các môn học này chưa được tính trong khối kiến thức chuyên ngành.\n\n· Hoặc, các môn học thuộc khối kiến thức giáo dục chuyên nghiệp trong các chương trình đào tạo đại học hoặc sau đại học của Trường ĐHCNTT hoặc của các Trường đại học khác trong ĐHQG –HCM hoặc của các Trường khác ngoài ĐHQG – HCM mà có ký kết hợp tác với Trường ĐH CNTT. Các môn học tương đương nhau chỉ được tính một lần vào tổng số tín chỉ tích lũy.\n\nDanh sách môn tự chọn tự do gợi ý:\n\n[Bảng 1] Bảng 12 hàng x 6 cột. Các cột: STT, Mã môn, Tên môn, ...\n: STT, : Mã môn, : Tên môn, : TC, : LT, : TH\nSTT: 1., Mã môn: IE213, Tên môn: Kỹ thuật phát triển hệ thống Web, TC: 4, LT: 3, TH: 1\nSTT: 2., Mã môn: IE307, Tên môn: Công nghệ lập trình đa nền tảng cho ứng dụng di động, TC: 4, LT: 3, TH: 1\nSTT: 3., Mã môn: IE233, Tên môn: Phân tích và mô hình mạng xã hội, TC: 4, LT: 3, TH: 1\nSTT: 4., Mã môn: IE403, Tên môn: Khai thác dữ liệu truyền thông xã hội, TC: 3, LT: 3, TH: 0\nSTT: 5., Mã môn: DS300, Tên môn: Hệ khuyến nghị, TC: 4, LT: 3, TH: 1\nSTT: 6., Mã môn: IE203, Tên môn: Hệ thống quản trị qui trình nghiệp vụ, TC: 4, LT: 3, TH: 1\nSTT: 7., Mã môn: IE204, Tên môn: Tối ưu hóa công cụ tìm kiếm (SEO), TC: 4, LT: 3, TH: 1\nSTT: 8., Mã môn: IE303, Tên môn: Công nghệ Java, TC: 4, LT: 3, TH: 1\nSTT: 9., Mã môn: IE310, Tên môn: Tư duy thiết kế, TC: 3, LT: 3, TH: 0\nSTT: 10., Mã môn: IE301, Tên môn: Quản trị quan hệ khách hàng, TC: 3, LT: 3, TH: 0\nSTT: 11., Mã môn: DS322, Tên môn: Thiết kế hệ thống học máy, TC: 4, LT: 3, TH: 1\nSTT: Và các môn học khác theo đề nghị của Khoa\n[Bảng 2] Bảng 12 hàng x 6 cột. Các cột: STT, Mã môn, Tên môn, ...\n: STT, : Mã môn, : Tên môn, : TC, : LT, : TH\nSTT: 1., Mã môn: IE201, Tên môn: Xử lý dữ liệu thống kê, TC: 3, LT: 3, TH: 0\nSTT: 2., Mã môn: IE221, Tên môn: Kỹ thuật lập trình Python, TC: 4, LT: 3, TH: 1\nSTT: 3., Mã môn: DS108, Tên môn: Tiền xử lý và xây dựng bộ dữ liệu, TC: 4, LT: 3, TH: 1\nSTT: 4., Mã môn: IE313, Tên môn: Phân tích và trực quan dữ liệu, TC: 4, LT: 3, TH: 1\nSTT: 5., Mã môn: IE212, Tên môn: Công nghệ Dữ liệu lớn, TC: 4, LT: 3, TH: 1\nSTT: 6., Mã môn: IE302, Tên môn: Kiến trúc và tích hợp hệ thống, TC: 3, LT: 3, TH: 0\nSTT: 7., Mã môn: IE402, Tên môn: Hệ thống thông tin địa lý 3 chiều, TC: 4, LT: 3, TH: 1\nSTT: 8., Mã môn: DS307, Tên môn: Phân tích dữ liệu truyền thông xã hội, TC: 3, LT: 3, TH: 0\nSTT: 9., Mã môn: DS317, Tên môn: Khai phá dữ liệu trong doanh nghiệp, TC: 4, LT: 3, TH: 1\nSTT: 10., Mã môn: IE102, Tên môn: Các công nghệ nền, TC: 3, LT: 2, TH: 1\nSTT: 11., Mã môn: IE231, Tên môn: Quản trị doanh nghiệp công nghệ thông tin, TC: 3, LT: 3, TH: 0\nSTT: Và các môn học khác theo đề nghị của Khoa\n[Bảng 3] Bảng 10 hàng x 6 cột. Các cột: STT, Mã môn, Tên môn, ...\n: STT, : Mã môn, : Tên môn, : TC, : LT, : TH\nSTT: 1., Mã môn: BUS1125, Tên môn: Khởi nghiệp kinh doanh, TC: 3, LT: 2, TH: 1\nSTT: 2., Mã môn: TLH025, Tên môn: Tâm lý học nhân cách, TC: 3, LT: 3, TH: 0\nSTT: 3., Mã môn: INI01, Tên môn: Thực tập quốc tế, TC: 2, LT: 2, TH: 0\nSTT: 4., Mã môn: IE207, Tên môn: Đồ án, TC: 2, LT: 0, TH: 2\nSTT: 5., Mã môn: IE309, Tên môn: Thực tập doanh nghiệp, TC: 2, LT: 2, TH: 0\nSTT: 6., Mã môn: DS323, Tên môn: Viết báo cáo kỹ thuật và thuyết trình, TC: 3, LT: 3, TH: 0\nSTT: 7., Mã môn: SE113, Tên môn: Kiểm chứng phần mềm (Có môn học trước), TC: 4, LT: 3, TH: 1\nSTT: 8., Mã môn: NT212, Tên môn: An toàn dữ liệu, khôi phục thông tin sau sự cố (Có môn học trước), TC: 3, LT: 2, TH: 1\nSTT: 9., Mã môn: NT213, Tên môn: Bảo mật web và ứng dụng (Có môn học trước), TC: 3, LT: 2, TH: 1\nSTT: Và các môn học khác theo đề nghị của Khoa"
      ],
      "ground_truth": "",
      "expected_intent": "roadmap",
      "metadata": {
        "major_used": null,
        "chunks_retrieved": 0,
        "sections_retrieved": 5,
        "total_time_ms": 25987.893104553223
      },
      "sources": [
        {
          "section_id": "ec503a07eeb1",
          "title": "Học kì 6",
          "hierarchy_path": "Ngành Công Nghệ Thông Tin > Kế hoạch giảng dạy mẫu > Học kì 6",
          "text_preview": "[Ngành Công Nghệ Thông Tin > Kế hoạch giảng dạy mẫu > Học kì 6]\n\n\n\n[Bảng 1] Bảng 6 hàng x 5 cột. Các cột: Mã môn, Tên môn học, TC, ...\n: Mã môn, : Tên môn học, : TC, : LT, : TH\nMã môn: SS010, Tên môn học: Lịch sử Đảng Cộng sản Việt Nam, TC: 2, LT: 2, TH: 0\nMã môn: IE105, Tên môn học: Nhập môn bảo đảm và an ninh thông tin, TC: 4, LT: 3, TH: 1\nMã môn: IE108, Tên môn học: Phân tích thiết kế phần mềm, TC: 4, LT: 3, TH: 1\nMã môn: PE232, Tên môn học: Giáo dục thể chất 2, TC: Tính riêng\nTên môn học: Các môn học chuyên ngành (**), TC: ≥ 10\nTên môn học: Tổng số tín chỉ HK6, TC: ≥ 16",
          "score": 0.9874236
        },
        {
          "section_id": "321e6f23f56b",
          "title": "Học kỳ 6",
          "hierarchy_path": "Chương trình An Toàn Thông Tin > Kế hoạch giảng dạy mẫu > Học kỳ 6",
          "text_preview": "[Chương trình An Toàn Thông Tin > Kế hoạch giảng dạy mẫu > Học kỳ 6]\n\n---\n\n[Bảng 1] Bảng 7 hàng x 5 cột. Các cột: Mã môn học, Tên môn học, TC, ...\n: Mã môn học, : Tên môn học, : TC, : LT, : TH/BT\nMã môn học: NT230, Tên môn học: Cơ chế hoạt động của mã độc, TC: 3, LT: 2, TH/BT: 1\nMã môn học: SS003, Tên môn học: Tư tưởng Hồ Chí Minh, TC: 2, LT: 2, TH/BT: 0\nMã môn học: NT114, Tên môn học: Đồ án chuyên ngành, TC: 2, LT: 0, TH/BT: 2\nTên môn học: Môn chuyên ngành 2, TC: 3, LT: 2, TH/BT: 1\nTên môn học: Môn chuyên ngành 3, TC: 3, LT: 2, TH/BT: 1\nTên môn học: Môn tự chọn 1, TC: 3, LT: 2, TH/BT: 1\nMã môn học: Tổng, Tên môn học: Tổng tín chỉ học kỳ 6, TC: 16, LT: 10, TH/BT: 6",
          "score": 0.49928617
        },
        {
          "section_id": "b66123da3d05",
          "title": "Học kì 7",
          "hierarchy_path": "Ngành Công Nghệ Thông Tin > Kế hoạch giảng dạy mẫu > Học kì 7",
          "text_preview": "[Ngành Công Nghệ Thông Tin > Kế hoạch giảng dạy mẫu > Học kì 7]\n\n\n\n[Bảng 1] Bảng 4 hàng x 6 cột. Các cột: Mã môn, Tên môn học, TC, ...\n: Mã môn, : Tên môn học, : TC, : LT, : TH\nMã môn: IE400, Tên môn học: Chuyên đề tốt nghiệp (***)(Bắt buộc nếu chọn hình thức 2 ở khối kiến thức tốt nghiệp), TC: 4, LT: 4, : 0\nTên môn học: Các môn học chuyên ngành (**), TC: ≥1 2\nTên môn học: Tổng số tín chỉ HK7- Nếu không tính Chuyên đề tốt nghiệp: ≥&#xA0;&#x31;2 TC- Nếu tính Chuyên đề tốt nghiệp: ≥&#x31;6 TC, TC: ≥ 12 - 16",
          "score": 0.07765744
        },
        {
          "section_id": "28a66127704f",
          "title": "Học kì 2",
          "hierarchy_path": "Ngành Công Nghệ Thông Tin > Kế hoạch giảng dạy mẫu > Học kì 2",
          "text_preview": "[Ngành Công Nghệ Thông Tin > Kế hoạch giảng dạy mẫu > Học kì 2]\n\n\n\n[Bảng 1] Bảng 6 hàng x 5 cột. Các cột: Mã môn, Tên môn học, TC, ...\n: Mã môn, : Tên môn học, : TC, : LT, : TH\nMã môn: IT002, Tên môn học: Lập trình hướng đối tượng, TC: 4, LT: 3, TH: 1\nMã môn: IT003, Tên môn học: Cấu trúc dữ liệu và giải thuật, TC: 4, LT: 3, TH: 1\nMã môn: SS004, Tên môn học: Kỹ năng nghề nghiệp, TC: 2, LT: 2, TH: 0\nMã môn: MA004, Tên môn học: Cấu trúc rời rạc, TC: 4, LT: 4, TH: 0\nMã môn: ENG02, Tên môn học: Anh văn 2 (*), TC: 4, LT: 4, TH: 0\nTên môn học: Tổng số tín chỉ HK2, TC: 18",
          "score": 0.068662286
        },
        {
          "section_id": "40be15102e72",
          "title": "Nhóm các môn học chuyên ngành",
          "hierarchy_path": "Ngành Công Nghệ Thông Tin > Các khối kiến thức > Khối kiến thức giáo dục chuyên nghiệp > Nhóm các môn học chuyên ngành",
          "text_preview": "[Ngành Công Nghệ Thông Tin > Các khối kiến thức > Khối kiến thức giáo dục chuyên nghiệp > Nhóm các môn học chuyên ngành]\n\n**Bắt buộc** đối với sinh viên ngành Công nghệ thông tin (**Tối thiểu 26 tín chỉ**).\n\nSinh viên được chọn môn học chuyên ngành tự do sao cho **tổng số tín chỉ ³26.**&#x54;rong đó, sinh viên phải học các môn học thuộc danh mục 3.4.2.3 để **tích lũy tối thiểu 6 tín chỉ và tối đa 10 tín chỉ.**&#x43;ác môn học chuyên ngành bao gồm 02 hướng có vai trò như nhau, trong đó có một số môn thuộc 01 hướng sẽ được gom cụm. (Sinh viên có thể chọn các môn học thuộc cả 02 hướng, không nhất thiết cố định 01 hướng).\n\n1. **Hướng Truyền thông xã hội và công nghệ Web**\n\n2. **Hướng Khoa học thông tin**\n\n3. **Tự chọn tự do**\n\nTổng số tín chỉ cho các môn tự chọn tự do là tối thiểu 6 tín chỉvàtối đa10 tín chỉ.\n\nNgoài các môn học tự chọn trong danh sách bên dưới, sinh viên có thể chọn học:\n\n· Các môn học chuyên ngành (các môn học thuộc mục 3.4.2.1 đến 3.4.2.2), nếu các môn học này chưa được tính trong khối kiến thức chuyên ngành.\n\n· Hoặc, các môn học thuộc khối kiến thức giáo dục chuyên nghiệp trong các chương trình đào tạo đại học hoặc sau đại học của Trường ĐHCNTT hoặc của các Trường đại học khác trong ĐHQG –HCM hoặc của các Trường khác ngoài ĐHQG – HCM mà có ký kết hợp tác với Trường ĐH CNTT. Các môn học tương đương nhau chỉ được tính một lần vào tổng số tín chỉ tích lũy.\n\nDanh sách môn tự chọn tự do gợi ý:\n\n[Bảng 1] Bảng 12 hàng x 6 cột. Các cột: STT, Mã môn, Tên môn, ...\n: STT, : Mã môn, : Tên môn, : TC, : LT, : TH\nSTT: 1., Mã môn: IE213, Tên môn: Kỹ thuật phát triển hệ thống Web, TC: 4, LT: 3, TH: 1\nSTT: 2., Mã môn: IE307, Tên môn: Công nghệ lập trình đa nền tảng cho ứng dụng di động, TC: 4, LT: 3, TH: 1\nSTT: 3., Mã môn: IE233, Tên môn: Phân tích và mô hình mạng xã hội, TC: 4, LT: 3, TH: 1\nSTT: 4., Mã môn: IE403, Tên môn: Khai thác dữ liệu truyền thông xã hội, TC: 3, LT: 3, TH: 0\nSTT: 5., Mã môn: DS300, Tên môn: Hệ khuyến nghị, TC: 4, LT: 3, TH: 1\nSTT: 6., Mã môn: IE203, Tên môn: Hệ thống quản trị qui trình nghiệp vụ, TC: 4, LT: 3, TH: 1\nSTT: 7., Mã môn: IE204, Tên môn: Tối ưu hóa công cụ tìm kiếm (SEO), TC: 4, LT: 3, TH: 1\nSTT: 8., Mã môn: IE303, Tên môn: Công nghệ Java, TC: 4, LT: 3, TH: 1\nSTT: 9., Mã môn: IE310, Tên môn: Tư duy thiết kế, TC: 3, LT: 3, TH: 0\nSTT: 10., Mã môn: IE301, Tên môn: Quản trị quan hệ khách hàng, TC: 3, LT: 3, TH: 0\nSTT: 11., Mã môn: DS322, Tên môn: Thiết kế hệ thống học máy, TC: 4, LT: 3, TH: 1\nSTT: Và các môn học khác theo đề nghị của Khoa\n[Bảng 2] Bảng 12 hàng x 6 cột. Các cột: STT, Mã môn, Tên môn, ...\n: STT, : Mã môn, : Tên môn, : TC, : LT, : TH\nSTT: 1., Mã môn: IE201, Tên môn: Xử lý dữ liệu thống kê, TC: 3, LT: 3, TH: 0\nSTT: 2., Mã môn: IE221, Tên môn: Kỹ thuật lập trình Python, TC: 4, LT: 3, TH: 1\nSTT: 3., Mã môn: DS108, Tên môn: Tiền xử lý và xây dựng bộ dữ liệu, TC: 4, LT: 3, TH: 1\nSTT: 4., Mã môn: IE313, Tên môn: Phân tích và trực quan dữ liệu, TC: 4, LT: 3, TH: 1\nSTT: 5., Mã môn: IE212, Tên môn: Công nghệ Dữ liệu lớn, TC: 4, LT: 3, TH: 1\nSTT: 6., Mã môn: IE302, Tên môn: Kiến trúc và tích hợp hệ thống, TC: 3, LT: 3, TH: 0\nSTT: 7., Mã môn: IE402, Tên môn: Hệ thống thông tin địa lý 3 chiều, TC: 4, LT: 3, TH: 1\nSTT: 8., Mã môn: DS307, Tên môn: Phân tích dữ liệu truyền thông xã hội, TC: 3, LT: 3, TH: 0\nSTT: 9., Mã môn: DS317, Tên môn: Khai phá dữ liệu trong doanh nghiệp, TC: 4, LT: 3, TH: 1\nSTT: 10., Mã môn: IE102, Tên môn: Các công nghệ nền, TC: 3, LT: 2, TH: 1\nSTT: 11., Mã môn: IE231, Tên môn: Quản trị doanh nghiệp công nghệ thông tin, TC: 3, LT: 3, TH: 0\nSTT: Và các môn học khác theo đề nghị của Khoa\n[Bảng 3] Bảng 10 hàng x 6 cột. Các cột: STT, Mã môn, Tên môn, ...\n: STT, : Mã môn, : Tên môn, : TC, : LT, : TH\nSTT: 1., Mã môn: BUS1125, Tên môn: Khởi nghiệp kinh doanh, TC: 3, LT: 2, TH: 1\nSTT: 2., Mã môn: TLH025, Tên môn: Tâm lý học nhân cách, TC: 3, LT: 3, TH: 0\nSTT: 3., Mã môn: INI01, Tên môn: Thực tập quốc tế, TC: 2, LT: 2, TH: 0\nSTT: 4., Mã môn: IE207, Tên môn: Đồ án, TC: 2, LT: 0, TH: 2\nSTT: 5., Mã môn: IE309, Tên môn: Thực tập doanh nghiệp, TC: 2, LT: 2, TH: 0\nSTT: 6., Mã môn: DS323, Tên môn: Viết báo cáo kỹ thuật và thuyết trình, TC: 3, LT: 3, TH: 0\nSTT: 7., Mã môn: SE113, Tên môn: Kiểm chứng phần mềm (Có môn học trước), TC: 4, LT: 3, TH: 1\nSTT: 8., Mã môn: NT212, Tên môn: An toàn dữ liệu, khôi phục thông tin sau sự cố (Có môn học trước), TC: 3, LT: 2, TH: 1\nSTT: 9., Mã môn: NT213, Tên môn: Bảo mật web và ứng dụng (Có môn học trước), TC: 3, LT: 2, TH: 1\nSTT: Và các môn học khác theo đề nghị của Khoa",
          "score": 0.0434469
        }
      ]
    }
  ]
}