{
  "pipeline": "standard",
  "timestamp": "2025-12-25T18:03:59.131613",
  "intent_filter": "compare",
  "total_queries": 3,
  "results": [
    {
      "question": "Môn cơ sở dữ liệu phân tán khác gì với môn dữ liệu lớn?",
      "answer": "Môn cơ sở dữ liệu phân tán (IS211) tập trung vào kiến thức nền tảng về các hệ quản trị CSDL phân tán, bao gồm các kiến trúc, kỹ thuật xử lý dữ liệu trong môi trường phân tán, cũng như các khái niệm cơ bản về CSDL. Môn này cung cấp thông tin về các hệ quản trị CSDL phân tán, các kỹ thuật xử lý dữ liệu trong môi trường phân tán, và các khái niệm cơ bản về CSDL.\n\nTrong khi đó, môn dữ liệu lớn (IS405) tập trung vào những thách thức và cơ hội từ dữ liệu lớn, các mô hình và framework xử lý dữ liệu lớn đang được sử dụng rộng rãi hiện nay, cũng như các kiến thức về MapReduce, Apache Hadoop, Apache Spark. Môn này đi sâu vào việc xử lý lượng dữ liệu khổng lồ, thường là dữ liệu không có cấu trúc hoặc có cấu trúc phức tạp.",
      "contexts": [
        "[IS405 -- DỮ LIỆU LỚN > MÔ TẢ MÔN HỌC (Course description)]\n\nMôn học cung cấp cho sinh viên những kiến thức cơ bản về dữ liệu lớn như: định nghĩa, những đặc trưng cơ bản, các mô hình và framework xử lý dữ liệu lớn đang được sử dụng rộng rãi hiện nay. Ngoài ra, nội dung môn học còn giới thiệu đến sinh viên lịch sử hình thành, động lực phát triển, khả năng ứng dụng, nhu cầu quản trị, xử lý và những cơ hội, thách thức của dữ liệu lớn.\n\nCụ thể, sinh viên được trang bị những kiến thức chi tiết về các thành phần và phương thức hoạt động của mô hình xử lý dữ liệu lớn MapReduce, các framework xử lý dữ liệu lớn hàng đầu như Apache Hadoop, Apache Spark. Thông qua các bài tập, bài thực hành, đồ án sinh viên được rèn luyện để hiểu rõ những nội dung lý thuyết và vận dụng chúng để giải quyết các vấn đề dữ liệu lớn thực tế.",
        "[IS405 -- DỮ LIỆU LỚN > ĐÁNH GIÁ MÔN HỌC (Course assessment)]\n\nBảng 5\n\n[Bảng 1] Bảng 3 hàng x 4 cột. Các cột: Thành phần đánh giá, Bài đánh giá, CĐRMH, ...\n: Thành phần đánh giá, : Bài đánh giá, : CĐRMH, : Tỷ lệ (%)\nThành phần đánh giá: A1. Quá trình +-----------------------------------------------------------------------------------------------------------------------+-----------+ +-----------------------------------------------------------------------------------------------------------------------+-----------+, Bài đánh giá: A1.1. Bài tập cá nhân thiết kế giải thuật theo mô hình MapReduce\\ Thiết kế giải thuật trên mô hình xử lý phân tán dữ liệu lớn MapReduce. A1.2. Seminar hệ sinh thái dữ liệu lớn\\ Tìm hiểu và trình bày về các hệ thống hỗ trợ lưu trữ, quản lý, truy vấn, chuyển đổi, lập quy trình xử lý dữ liệu lớn. A1.3. Seminar hệ thống xử lý dữ liệu lớn\\ Tìm hiểu và trình bày về các hệ thống hỗ trợ xử lý dữ liệu lớn, xử lý theo thời gian thực..., CĐRMH: G1.3 G1.6 G4.1 G1.6 G4.1, Tỷ lệ (%): 20%\nThành phần đánh giá: A2. Thực hành +-----------------------------------------------------------------------------------------------------------------------+-----------+, Bài đánh giá: A2.1. Đồ án môn học\\ Thực hiện đồ án khai thác dữ liệu lớn trên nền tảng xử lý phân tán, viết báo cáo và seminar theo yêu cầu sau:\\ - Nhận diện và phát biểu được bài toán khai thác dữ liệu lớn.\\ - Hiểu được các đặc điểm và áp dụng các kỹ thuật tiền xử lý trên dữ liệu lớn.\\ - Mô tả và áp dụng các giải thuật khai thác dữ liệu song song, phân tán để giải quyết bài toán đã trình bày.\\ - Đánh giá, so sánh được kết quả giữa các phương pháp đã áp dụng. A2.2. Chuyên cần (điểm cộng)\\ Chăm chỉ, tích cực phát biểu, CĐRMH: G3.1 G3.2 G4.1 G2.1 G2.2, Tỷ lệ (%): 30%\nThành phần đánh giá: A3. Cuối kỳ, Bài đánh giá: Bài thi lý thuyết cuối kỳ, CĐRMH: G1.1 G1.2 G1.4 G1.5 G1.6, Tỷ lệ (%): 50%",
        "[IS211 -- CƠ SỞ DỮ LIỆU PHÂN TÁN > THÔNG TIN CHUNG]\n\n\n\n[Bảng 1] Bảng 9 hàng x 2 cột. Các cột: Tên môn học (tiếng Việt):, Cơ sở dữ liệu phân tán\n: Tên môn học (tiếng Việt):, : Cơ sở dữ liệu phân tán\nTên môn học (tiếng Việt):: Tên môn học (tiếng Anh):, Cơ sở dữ liệu phân tán: Distributed Databases\nTên môn học (tiếng Việt):: Mã môn học:, Cơ sở dữ liệu phân tán: IS211\nTên môn học (tiếng Việt):: Thuộc khối kiến thức:, Cơ sở dữ liệu phân tán: Chuyên ngành\nTên môn học (tiếng Việt):: Khoa/Bộ môn phụ trách:, Cơ sở dữ liệu phân tán: Hệ thống thông tin\nTên môn học (tiếng Việt):: Giảng viên biên soạn:, Cơ sở dữ liệu phân tán: ThS. Thái Bảo Trân, ThS. Nguyễn Hồ Duy Tri Email: [trantb@uit.edu.vn, tringuyen@uit.edu.vn]{.underline}\nTên môn học (tiếng Việt):: Số tín chỉ:, Cơ sở dữ liệu phân tán: 4\nTên môn học (tiếng Việt):: Lý thuyết:, Cơ sở dữ liệu phân tán: 3\nTên môn học (tiếng Việt):: Thực hành:, Cơ sở dữ liệu phân tán: 1\nTên môn học (tiếng Việt):: Môn học trước:, Cơ sở dữ liệu phân tán: Cơ sở dữ liệu, Nhập môn mạng máy tính",
        "[IS211 -- CƠ SỞ DỮ LIỆU PHÂN TÁN > MỤC TIÊU MÔN HỌC (Course Goals)]\n\nBảng 1\n\n[Bảng 1] Bảng 4 hàng x 3 cột. Các cột: ## Mục tiêu, ## Mục tiêu môn học, ## Chuẩn đầu ra trong CTĐT\n: ## Mục tiêu, : ## Mục tiêu môn học, : ## Chuẩn đầu ra trong CTĐT\n## Mục tiêu: G1, ## Mục tiêu môn học: - Mô tả được các khái niệm cơ bản về CSDL phân tán - Hiểu rõ các kiến trúc của hệ quản trị CSDL phân tán., ## Chuẩn đầu ra trong CTĐT: LO2 (2.7)\n## Mục tiêu: G2, ## Mục tiêu môn học: - Kỹ năng về thu thập các thông tin cho bài toán phân mảnh, phân tích và thiết kế được kiến trúc phân mảnh dữ liệu. - Kỹ năng thiết kế định vị các hệ cơ sở dữ liệu phân tán vào bài toán thực tế. - Kỹ năng xử lý dữ liệu ứng với các mức trong suốt khác nhau. - Kỹ năng tối ưu hóa câu truy vấn trong môi trường phân tán. - Kỹ năng về quản lý giao dịch và điều khiển đồng thời phân tán, vấn đề tương tranh và hiệu năng xử lý phân tán., ## Chuẩn đầu ra trong CTĐT: LO4 (4.1, 4.2)\n## Mục tiêu: G3, ## Mục tiêu môn học: -Vận dụng kỹ năng hình thành ý tưởng, thiết kế và xây dựng hệ thống để giải quyết một bài toán cụ thể trong môi trường phân tán. - Vận dụng được kỹ thuật xử lý phân tán và cách triển khai CSDL phân tán bằng Oracle/SQL Server., ## Chuẩn đầu ra trong CTĐT: LO4 (4.1, 4.2)\n## Mục tiêu: G4, ## Mục tiêu môn học: -Vận dụng kỹ năng làm việc nhóm, ## Chuẩn đầu ra trong CTĐT: LO5 (5.1, 5.2, 5.3, 5.4, 5.5, 5.6)",
        "[IS405 -- DỮ LIỆU LỚN > MỤC TIÊU MÔN HỌC (Course Goals)]\n\nBảng 1\n\n\n   **Mục tiêu**  **Mục tiêu môn học**                                                                                                                                              **Chuẩn đầu ra trong CTĐT**\n\n      **G1**     \\- Hiểu và trình bày được những khái niệm cơ bản liên quan đến dữ liệu lớn, những thách thức, cơ hội từ dữ liệu lớn và những ứng dụng trong đời sống xã hội.\\                 LO2\\\n                 - Hiểu và xây dựng được những giải thuật xử lý dữ liệu lớn trên mô hình MapReduce.\\                                                                                       (2.5, 2.7)\\\n                 - Hiểu và mô tả được các thành phần, cách thức hoạt động của các framework Apache Hadoop, Apache Spark.\\                                                                      LO3\\\n                 - Hiểu và mô tả được một số kiến trúc hệ thống xử lý dữ liệu lớn                                                                                                           (3.2, 3.3)\n\n      **G2**     Hiểu và lập trình được một số xử lý cơ bản với dữ liệu lớn trên nền tảng xử lý phân tán.                                                                                      LO3\\\n                                                                                                                                                                                            (3.2, 3.3)\n\n      **G3**     \\- Xác định và phát biểu bài toán về dữ liệu lớn.\\                                                                                                                            LO3\\\n                 - Vận dụng được những kỹ thuật xử lý dữ liệu lớn để giải quyết một bài toán cụ thể.                                                                                     (3.1, 3.2, 3.3)\n\n      **G4**     Vận dụng kỹ năng làm việc nhóm                                                                                                                                                LO5\\\n                                                                                                                                                                                  (5.1, 5.2, 5.3, 5.4, 5.5, 5.6)"
      ],
      "ground_truth": "",
      "expected_intent": "compare",
      "metadata": {
        "major_used": null,
        "chunks_retrieved": 0,
        "sections_retrieved": 5,
        "total_time_ms": 24974.472999572754
      },
      "sources": [
        {
          "section_id": "dccd589bcf78",
          "title": "MÔ TẢ MÔN HỌC (Course description)",
          "hierarchy_path": "IS405 -- DỮ LIỆU LỚN > MÔ TẢ MÔN HỌC (Course description)",
          "text_preview": "[IS405 -- DỮ LIỆU LỚN > MÔ TẢ MÔN HỌC (Course description)]\n\nMôn học cung cấp cho sinh viên những kiến thức cơ bản về dữ liệu lớn như: định nghĩa, những đặc trưng cơ bản, các mô hình và framework xử lý dữ liệu lớn đang được sử dụng rộng rãi hiện nay. Ngoài ra, nội dung môn học còn giới thiệu đến sinh viên lịch sử hình thành, động lực phát triển, khả năng ứng dụng, nhu cầu quản trị, xử lý và những cơ hội, thách thức của dữ liệu lớn.\n\nCụ thể, sinh viên được trang bị những kiến thức chi tiết về các thành phần và phương thức hoạt động của mô hình xử lý dữ liệu lớn MapReduce, các framework xử lý dữ liệu lớn hàng đầu như Apache Hadoop, Apache Spark. Thông qua các bài tập, bài thực hành, đồ án sinh viên được rèn luyện để hiểu rõ những nội dung lý thuyết và vận dụng chúng để giải quyết các vấn đề dữ liệu lớn thực tế.",
          "score": 0.13998318
        },
        {
          "section_id": "4256c0912520",
          "title": "ĐÁNH GIÁ MÔN HỌC (Course assessment)",
          "hierarchy_path": "IS405 -- DỮ LIỆU LỚN > ĐÁNH GIÁ MÔN HỌC (Course assessment)",
          "text_preview": "[IS405 -- DỮ LIỆU LỚN > ĐÁNH GIÁ MÔN HỌC (Course assessment)]\n\nBảng 5\n\n[Bảng 1] Bảng 3 hàng x 4 cột. Các cột: Thành phần đánh giá, Bài đánh giá, CĐRMH, ...\n: Thành phần đánh giá, : Bài đánh giá, : CĐRMH, : Tỷ lệ (%)\nThành phần đánh giá: A1. Quá trình +-----------------------------------------------------------------------------------------------------------------------+-----------+ +-----------------------------------------------------------------------------------------------------------------------+-----------+, Bài đánh giá: A1.1. Bài tập cá nhân thiết kế giải thuật theo mô hình MapReduce\\ Thiết kế giải thuật trên mô hình xử lý phân tán dữ liệu lớn MapReduce. A1.2. Seminar hệ sinh thái dữ liệu lớn\\ Tìm hiểu và trình bày về các hệ thống hỗ trợ lưu trữ, quản lý, truy vấn, chuyển đổi, lập quy trình xử lý dữ liệu lớn. A1.3. Seminar hệ thống xử lý dữ liệu lớn\\ Tìm hiểu và trình bày về các hệ thống hỗ trợ xử lý dữ liệu lớn, xử lý theo thời gian thực..., CĐRMH: G1.3 G1.6 G4.1 G1.6 G4.1, Tỷ lệ (%): 20%\nThành phần đánh giá: A2. Thực hành +-----------------------------------------------------------------------------------------------------------------------+-----------+, Bài đánh giá: A2.1. Đồ án môn học\\ Thực hiện đồ án khai thác dữ liệu lớn trên nền tảng xử lý phân tán, viết báo cáo và seminar theo yêu cầu sau:\\ - Nhận diện và phát biểu được bài toán khai thác dữ liệu lớn.\\ - Hiểu được các đặc điểm và áp dụng các kỹ thuật tiền xử lý trên dữ liệu lớn.\\ - Mô tả và áp dụng các giải thuật khai thác dữ liệu song song, phân tán để giải quyết bài toán đã trình bày.\\ - Đánh giá, so sánh được kết quả giữa các phương pháp đã áp dụng. A2.2. Chuyên cần (điểm cộng)\\ Chăm chỉ, tích cực phát biểu, CĐRMH: G3.1 G3.2 G4.1 G2.1 G2.2, Tỷ lệ (%): 30%\nThành phần đánh giá: A3. Cuối kỳ, Bài đánh giá: Bài thi lý thuyết cuối kỳ, CĐRMH: G1.1 G1.2 G1.4 G1.5 G1.6, Tỷ lệ (%): 50%",
          "score": 0.07263671
        },
        {
          "section_id": "0ee9cba95b78",
          "title": "THÔNG TIN CHUNG",
          "hierarchy_path": "IS211 -- CƠ SỞ DỮ LIỆU PHÂN TÁN > THÔNG TIN CHUNG",
          "text_preview": "[IS211 -- CƠ SỞ DỮ LIỆU PHÂN TÁN > THÔNG TIN CHUNG]\n\n\n\n[Bảng 1] Bảng 9 hàng x 2 cột. Các cột: Tên môn học (tiếng Việt):, Cơ sở dữ liệu phân tán\n: Tên môn học (tiếng Việt):, : Cơ sở dữ liệu phân tán\nTên môn học (tiếng Việt):: Tên môn học (tiếng Anh):, Cơ sở dữ liệu phân tán: Distributed Databases\nTên môn học (tiếng Việt):: Mã môn học:, Cơ sở dữ liệu phân tán: IS211\nTên môn học (tiếng Việt):: Thuộc khối kiến thức:, Cơ sở dữ liệu phân tán: Chuyên ngành\nTên môn học (tiếng Việt):: Khoa/Bộ môn phụ trách:, Cơ sở dữ liệu phân tán: Hệ thống thông tin\nTên môn học (tiếng Việt):: Giảng viên biên soạn:, Cơ sở dữ liệu phân tán: ThS. Thái Bảo Trân, ThS. Nguyễn Hồ Duy Tri Email: [trantb@uit.edu.vn, tringuyen@uit.edu.vn]{.underline}\nTên môn học (tiếng Việt):: Số tín chỉ:, Cơ sở dữ liệu phân tán: 4\nTên môn học (tiếng Việt):: Lý thuyết:, Cơ sở dữ liệu phân tán: 3\nTên môn học (tiếng Việt):: Thực hành:, Cơ sở dữ liệu phân tán: 1\nTên môn học (tiếng Việt):: Môn học trước:, Cơ sở dữ liệu phân tán: Cơ sở dữ liệu, Nhập môn mạng máy tính",
          "score": 0.02145073
        },
        {
          "section_id": "35f0e060768a",
          "title": "MỤC TIÊU MÔN HỌC (Course Goals)",
          "hierarchy_path": "IS211 -- CƠ SỞ DỮ LIỆU PHÂN TÁN > MỤC TIÊU MÔN HỌC (Course Goals)",
          "text_preview": "[IS211 -- CƠ SỞ DỮ LIỆU PHÂN TÁN > MỤC TIÊU MÔN HỌC (Course Goals)]\n\nBảng 1\n\n[Bảng 1] Bảng 4 hàng x 3 cột. Các cột: ## Mục tiêu, ## Mục tiêu môn học, ## Chuẩn đầu ra trong CTĐT\n: ## Mục tiêu, : ## Mục tiêu môn học, : ## Chuẩn đầu ra trong CTĐT\n## Mục tiêu: G1, ## Mục tiêu môn học: - Mô tả được các khái niệm cơ bản về CSDL phân tán - Hiểu rõ các kiến trúc của hệ quản trị CSDL phân tán., ## Chuẩn đầu ra trong CTĐT: LO2 (2.7)\n## Mục tiêu: G2, ## Mục tiêu môn học: - Kỹ năng về thu thập các thông tin cho bài toán phân mảnh, phân tích và thiết kế được kiến trúc phân mảnh dữ liệu. - Kỹ năng thiết kế định vị các hệ cơ sở dữ liệu phân tán vào bài toán thực tế. - Kỹ năng xử lý dữ liệu ứng với các mức trong suốt khác nhau. - Kỹ năng tối ưu hóa câu truy vấn trong môi trường phân tán. - Kỹ năng về quản lý giao dịch và điều khiển đồng thời phân tán, vấn đề tương tranh và hiệu năng xử lý phân tán., ## Chuẩn đầu ra trong CTĐT: LO4 (4.1, 4.2)\n## Mục tiêu: G3, ## Mục tiêu môn học: -Vận dụng kỹ năng hình thành ý tưởng, thiết kế và xây dựng hệ thống để giải quyết một bài toán cụ thể trong môi trường phân tán. - Vận dụng được kỹ thuật xử lý phân tán và cách triển khai CSDL phân tán bằng Oracle/SQL Server., ## Chuẩn đầu ra trong CTĐT: LO4 (4.1, 4.2)\n## Mục tiêu: G4, ## Mục tiêu môn học: -Vận dụng kỹ năng làm việc nhóm, ## Chuẩn đầu ra trong CTĐT: LO5 (5.1, 5.2, 5.3, 5.4, 5.5, 5.6)",
          "score": 0.017375665
        },
        {
          "section_id": "e10bffad7c4a",
          "title": "MỤC TIÊU MÔN HỌC (Course Goals)",
          "hierarchy_path": "IS405 -- DỮ LIỆU LỚN > MỤC TIÊU MÔN HỌC (Course Goals)",
          "text_preview": "[IS405 -- DỮ LIỆU LỚN > MỤC TIÊU MÔN HỌC (Course Goals)]\n\nBảng 1\n\n\n   **Mục tiêu**  **Mục tiêu môn học**                                                                                                                                              **Chuẩn đầu ra trong CTĐT**\n\n      **G1**     \\- Hiểu và trình bày được những khái niệm cơ bản liên quan đến dữ liệu lớn, những thách thức, cơ hội từ dữ liệu lớn và những ứng dụng trong đời sống xã hội.\\                 LO2\\\n                 - Hiểu và xây dựng được những giải thuật xử lý dữ liệu lớn trên mô hình MapReduce.\\                                                                                       (2.5, 2.7)\\\n                 - Hiểu và mô tả được các thành phần, cách thức hoạt động của các framework Apache Hadoop, Apache Spark.\\                                                                      LO3\\\n                 - Hiểu và mô tả được một số kiến trúc hệ thống xử lý dữ liệu lớn                                                                                                           (3.2, 3.3)\n\n      **G2**     Hiểu và lập trình được một số xử lý cơ bản với dữ liệu lớn trên nền tảng xử lý phân tán.                                                                                      LO3\\\n                                                                                                                                                                                            (3.2, 3.3)\n\n      **G3**     \\- Xác định và phát biểu bài toán về dữ liệu lớn.\\                                                                                                                            LO3\\\n                 - Vận dụng được những kỹ thuật xử lý dữ liệu lớn để giải quyết một bài toán cụ thể.                                                                                     (3.1, 3.2, 3.3)\n\n      **G4**     Vận dụng kỹ năng làm việc nhóm                                                                                                                                                LO5\\\n                                                                                                                                                                                  (5.1, 5.2, 5.3, 5.4, 5.5, 5.6)",
          "score": 0.007489625
        }
      ]
    },
    {
      "question": "Môn cơ sơ dữ liệu có gì khác với hệ quản trị cơ sở dữ liệu?",
      "answer": "Môn cơ sở dữ liệu (IT004) trình bày về sự cần thiết của cơ sở dữ liệu trong doanh nghiệp và các tổ chức, cung cấp sự hiểu biết về nguyên lý của các hệ thống cơ sở dữ liệu (CSDL), tập trung vào CSDL quan hệ (mô hình dữ liệu quan hệ, ngôn ngữ thao tác, truy vấn dữ liệu).\n\nTrong khi đó, Hệ quản trị cơ sở dữ liệu (HQTCSDL) là một phần mềm, một hệ thống được sử dụng để quản lý và thao tác với CSDL.  Môn IT004 giúp sinh viên sử dụng các kỹ thuật, công cụ để thiết kế, thao tác với CSDL quan hệ thông qua hệ quản trị CSDL cụ thể (MS SQL Server).\n",
      "contexts": [
        "[IT004 -- CƠ SỞ DỮ LIỆU (2022-RUBRIC) > MÔ TẢ MÔN HỌC (Course description)]\n\nMôn học trình bày về sự cần thiết của cơ sở dữ liệu trong doanh nghiệp và trong các loại hình tổ chức khác. Cung cấp sự hiểu biết về nguyên lý của các hệ thống cơ sở dữ liệu (CSDL), tập trung trên CSDL quan hệ (mô hình dữ liệu quan hệ, ngôn ngữ thao tác, truy vấn dữ liệu). Sinh viên có khả năng sử dụng các kỹ thuật, công cụ để có thể thiết kế, thao tác với một CSDL quan hệ thông qua hệ quản trị CSDL cụ thể (MS SQL Server), phục vụ cho nhiều môn học nâng cao về CSDL trong những học kỳ kế tiếp.",
        "[IS210 -- HỆ QUẢN TRỊ CƠ SỞ DỮ LIỆU > MÔ TẢ MÔN HỌC(Course description)]\n\nMôn học trình bày khái niệm cơ bản về các hệ quản trị cơ sở dữ liệu (HQTCSDL) hiện đại và đặc tính chung của chúng. Đi sâu vào trình bày thành phần của một HQTCSDL quan hệ, nguyên tắc hoạt động của các giao tác, cơ chế quản lý truy xuất đồng thời, an toàn và khôi phục dữ liệu sau sự cố, tối ưu hóa câu truy vấn. Mỗi nội dung trình bày giải pháp cài đặt cụ thể của chúng trên một trong những HQTCSDL quan hệ đã thương mại như MS SQL Server, DB2, Oracle, MySQL,....\n\nThông qua các bài tập, đồ án, thực hành, sinh viên có thể vận dụng các kiến thức, kỹ năng để giải quyết các bài toán ứng dụng HQTCSDL vào thực tế. Cụ thể, sinh viên có thể sử dụng thành thạo một số công cụ để quản lý và làm việc với HQTCSDL, có thể thành thạo SQL, function, store procedure, trigger, có khả năng liên hệ giữa lý thuyết và cú pháp thực hành tương ứng. Có thể nắm bắt các kỹ thuật quan trọng như sao lưu dữ liệu, phân tích dữ liệu, tối ưu hóa cơ sở dữ liệu qua các công cụ đi kèm hoặc do bên thứ ba cung cấp để hoạt động cùng các HQTCSDL. Ngoài ra, sinh viên cũng được khuyến khích nghiên cứu, thử nghiệm các kỹ thuật xây dựng ứng dụng có sử dụng HQTCSDL quan hệ như là thành phần lưu trữ dữ liệu của ứng dụng.",
        "[IS210 -- HỆ QUẢN TRỊ CƠ SỞ DỮ LIỆU > THÔNG TIN CHUNG]\n\n\n\n[Bảng 1] Bảng 11 hàng x 2 cột. Các cột: Tên môn học (tiếng Việt):, Hệ Quản trị Cơ sở Dữ liệu\n: Tên môn học (tiếng Việt):, : Hệ Quản trị Cơ sở Dữ liệu\nTên môn học (tiếng Việt):: Tên môn học (tiếng Anh):, Hệ Quản trị Cơ sở Dữ liệu: Database Management System\nTên môn học (tiếng Việt):: Mã môn học:, Hệ Quản trị Cơ sở Dữ liệu: IS210\nTên môn học (tiếng Việt):: Thuộc khối kiến thức:, Hệ Quản trị Cơ sở Dữ liệu: Chuyên ngành\nTên môn học (tiếng Việt):: Khoa/Bộ môn phụ trách:, Hệ Quản trị Cơ sở Dữ liệu: Khoa HTTT\nTên môn học (tiếng Việt):: Giảng viên phụ trách:, Hệ Quản trị Cơ sở Dữ liệu: ThS. Đỗ Thị Minh Phụng, ThS. Thái Bảo Trân Email: phungdtm@uit.edu.vn, trantb@uit.edu.vn\nTên môn học (tiếng Việt):: Giảng viên tham gia giảng dạy:, Hệ Quản trị Cơ sở Dữ liệu: các giảng viên khoa HTTT\nTên môn học (tiếng Việt):: Số tín chỉ:, Hệ Quản trị Cơ sở Dữ liệu: 4 TC lý thuyết : 3 TC thực hành :1\nTên môn học (tiếng Việt):: Lý thuyết: (tiết), Hệ Quản trị Cơ sở Dữ liệu: 45 tiết\nTên môn học (tiếng Việt):: Thực hành: (tiết), Hệ Quản trị Cơ sở Dữ liệu: 30 tiết\nTên môn học (tiếng Việt):: Tính chất của môn, Hệ Quản trị Cơ sở Dữ liệu: Bắt buộc đối với sinh viên ngành/chuyên ngành\nTên môn học (tiếng Việt):: Môn học trước, Hệ Quản trị Cơ sở Dữ liệu: Cơ sở dữ liệu",
        "[Chương trình Khoa Học Dữ Liệu > Khối kiến thức giáo dục chuyên nghiệp > Nhóm các môn học cơ sở ngành]\n\n‒ **Bắt buộc** đối với tất cả sinh viên ngành Khoa học Dữ liệu (tổng cộng **42** tín chỉ).\n\n‒ Cung cấp kiến thức nền tảng về Khoa học Dữ liệu.\n\n**Chú thích:**\n\n‒ TC: Số tín chỉ của môn học.\n\n‒ LT: Số tín chỉ lý thuyết của môn học.\n\n‒ TH: Số tín chỉ thực hành của môn học.\n\n[Bảng 1] Bảng 19 hàng x 6 cột. Các cột: STT, Mã môn học, Tên môn học, ...\n: STT, : Mã môn học, : Tên môn học, : TC, : LT, : TH\nSTT: Giới thiệu ngành, TC: 1, LT: 1, TH: 0\nSTT: 1, Mã môn học: DS005, Tên môn học: Giới thiệu ngành Khoa học dữ liệu, TC: 1, LT: 1, TH: 0\nSTT: Kiến thức về lập trình, TC: 8, LT: 6, TH: 2\nSTT: 2, Mã môn học: IT002, Tên môn học: Lập trình hướng đối tượng, TC: 4, LT: 3, TH: 1\nSTT: 3, Mã môn học: IT003, Tên môn học: Cấu trúc dữ liệu và giải thuật, TC: 4, LT: 3, TH: 1\nSTT: Kiến thức về cơ sở dữ liệu, TC: 4, LT: 3, TH: 1\nSTT: 4, Mã môn học: IT004, Tên môn học: Cơ sở dữ liệu, TC: 4, LT: 3, TH: 1\nSTT: Kiến thức về mạng máy tính, TC: 4, LT: 3, TH: 1\nSTT: 5, Mã môn học: IT005, Tên môn học: Nhập môn mạng máy tính, TC: 4, LT: 3, TH: 1\nSTT: Kiến thức về phần cứng máy tính, TC: 6, LT: 5, TH: 1\nSTT: 6, Mã môn học: IT010, Tên môn học: Tổ chức và cấu trúc máy tính, TC: 2, LT: 2, TH: 0\nSTT: 7, Mã môn học: IT007, Tên môn học: Hệ điều hành, TC: 4, LT: 3, TH: 1\nSTT: Kiến thức nền tảng về Khoa học Dữ liệu, TC: 19, LT: 14, TH: 5\nSTT: 8, Mã môn học: DS107, Tên môn học: Tư duy tính toán cho Khoa học dữ liệu, TC: 4, LT: 3, TH: 1\nSTT: 9, Mã môn học: DS101, Tên môn học: Thống kê và xác suất chuyên sâu, TC: 3, LT: 2, TH: 1\nSTT: 10, Mã môn học: DS111, Tên môn học: Phân tích dữ liệu, TC: 4, LT: 3, TH: 1\nSTT: 11, Mã môn học: DS102, Tên môn học: Học máy thống kê, TC: 4, LT: 3, TH: 1\nSTT: 12, Mã môn học: DS108, Tên môn học: Tiền xử lý và xây dựng bộ dữ liệu, TC: 4, LT: 3, TH: 1\nSTT: Tổng số tín chỉ, TC: 42, LT: 32, TH: 10",
        "[IS210 -- HỆ QUẢN TRỊ CƠ SỞ DỮ LIỆU > MỤC TIÊU MÔN HỌC (Course Goals)]\n\nBảng 1.\n\n[Bảng 1] Bảng 3 hàng x 3 cột. Các cột: ## Mục tiêu [1], ## Mục tiêu môn học [2], Chuẩn đầu ra trong CTĐT\n: ## Mục tiêu [1], : ## Mục tiêu môn học [2], : Chuẩn đầu ra trong CTĐT\n## Mục tiêu [1]: G1, ## Mục tiêu môn học [2]: Hiểu được các khái niệm cơ bản: HQTCSDL, các mức trừu tượng của dữ liệu, kiến trúc HQTCSDL, giao tác, lịch thao tác, truy xuất đồng thời, an toàn và bảo mật, tối ưu hóa câu truy vấn..., Chuẩn đầu ra trong CTĐT: LO2 (2.7)\n## Mục tiêu [1]: G2 +------------------------------------------------------------------------------------------------------------------------------------------------------------------------------------------+ +------------------------------------------------------------------------------------------------------------------------------------------------------------------------------------------+ +------------------------------------------------------------------------------------------------------------------------------------------------------------------------------------------+, ## Mục tiêu môn học [2]: - Kỹ năng xây dựng giao tác tường minh - Kỹ năng giải quyết được các vấn đề có thể xảy ra khi cho nhiều giao tác thực hiện đồng thời - Kỹ năng liên quan đến cơ chế an toàn và khôi phục dữ liệu sau sự cố - Kỹ năng viết câu truy vấn tối ưu, Chuẩn đầu ra trong CTĐT: LO4 (4.1, 4.2)\n## Mục tiêu [1]: G3 +------------------------------------------------------------------------------------------------------------------------------------------------------------------------------------------+, ## Mục tiêu môn học [2]: - Vận dụng thành thạo ngôn ngữ SQL nâng cao, cài đặt được trên một HQTCSDL thương mại (MS SQL Server, Oracle, DB2, MySQL, ...) - Hiện thực yêu cầu tối ưu hoá câu truy vấn trên một HQTCSDL thương mại (MS SQL Server, Oracle, DB2, MySQL, ...), Chuẩn đầu ra trong CTĐT: LO4 (4.1, 4.2)"
      ],
      "ground_truth": "",
      "expected_intent": "compare",
      "metadata": {
        "major_used": null,
        "chunks_retrieved": 0,
        "sections_retrieved": 5,
        "total_time_ms": 14737.47992515564
      },
      "sources": [
        {
          "section_id": "bc656ae34ed3",
          "title": "MÔ TẢ MÔN HỌC (Course description)",
          "hierarchy_path": "IT004 -- CƠ SỞ DỮ LIỆU (2022-RUBRIC) > MÔ TẢ MÔN HỌC (Course description)",
          "text_preview": "[IT004 -- CƠ SỞ DỮ LIỆU (2022-RUBRIC) > MÔ TẢ MÔN HỌC (Course description)]\n\nMôn học trình bày về sự cần thiết của cơ sở dữ liệu trong doanh nghiệp và trong các loại hình tổ chức khác. Cung cấp sự hiểu biết về nguyên lý của các hệ thống cơ sở dữ liệu (CSDL), tập trung trên CSDL quan hệ (mô hình dữ liệu quan hệ, ngôn ngữ thao tác, truy vấn dữ liệu). Sinh viên có khả năng sử dụng các kỹ thuật, công cụ để có thể thiết kế, thao tác với một CSDL quan hệ thông qua hệ quản trị CSDL cụ thể (MS SQL Server), phục vụ cho nhiều môn học nâng cao về CSDL trong những học kỳ kế tiếp.",
          "score": 0.7318259
        },
        {
          "section_id": "cc1863fd9c06",
          "title": "MÔ TẢ MÔN HỌC(Course description)",
          "hierarchy_path": "IS210 -- HỆ QUẢN TRỊ CƠ SỞ DỮ LIỆU > MÔ TẢ MÔN HỌC(Course description)",
          "text_preview": "[IS210 -- HỆ QUẢN TRỊ CƠ SỞ DỮ LIỆU > MÔ TẢ MÔN HỌC(Course description)]\n\nMôn học trình bày khái niệm cơ bản về các hệ quản trị cơ sở dữ liệu (HQTCSDL) hiện đại và đặc tính chung của chúng. Đi sâu vào trình bày thành phần của một HQTCSDL quan hệ, nguyên tắc hoạt động của các giao tác, cơ chế quản lý truy xuất đồng thời, an toàn và khôi phục dữ liệu sau sự cố, tối ưu hóa câu truy vấn. Mỗi nội dung trình bày giải pháp cài đặt cụ thể của chúng trên một trong những HQTCSDL quan hệ đã thương mại như MS SQL Server, DB2, Oracle, MySQL,....\n\nThông qua các bài tập, đồ án, thực hành, sinh viên có thể vận dụng các kiến thức, kỹ năng để giải quyết các bài toán ứng dụng HQTCSDL vào thực tế. Cụ thể, sinh viên có thể sử dụng thành thạo một số công cụ để quản lý và làm việc với HQTCSDL, có thể thành thạo SQL, function, store procedure, trigger, có khả năng liên hệ giữa lý thuyết và cú pháp thực hành tương ứng. Có thể nắm bắt các kỹ thuật quan trọng như sao lưu dữ liệu, phân tích dữ liệu, tối ưu hóa cơ sở dữ liệu qua các công cụ đi kèm hoặc do bên thứ ba cung cấp để hoạt động cùng các HQTCSDL. Ngoài ra, sinh viên cũng được khuyến khích nghiên cứu, thử nghiệm các kỹ thuật xây dựng ứng dụng có sử dụng HQTCSDL quan hệ như là thành phần lưu trữ dữ liệu của ứng dụng.",
          "score": 0.70324385
        },
        {
          "section_id": "f7614c89db1f",
          "title": "THÔNG TIN CHUNG",
          "hierarchy_path": "IS210 -- HỆ QUẢN TRỊ CƠ SỞ DỮ LIỆU > THÔNG TIN CHUNG",
          "text_preview": "[IS210 -- HỆ QUẢN TRỊ CƠ SỞ DỮ LIỆU > THÔNG TIN CHUNG]\n\n\n\n[Bảng 1] Bảng 11 hàng x 2 cột. Các cột: Tên môn học (tiếng Việt):, Hệ Quản trị Cơ sở Dữ liệu\n: Tên môn học (tiếng Việt):, : Hệ Quản trị Cơ sở Dữ liệu\nTên môn học (tiếng Việt):: Tên môn học (tiếng Anh):, Hệ Quản trị Cơ sở Dữ liệu: Database Management System\nTên môn học (tiếng Việt):: Mã môn học:, Hệ Quản trị Cơ sở Dữ liệu: IS210\nTên môn học (tiếng Việt):: Thuộc khối kiến thức:, Hệ Quản trị Cơ sở Dữ liệu: Chuyên ngành\nTên môn học (tiếng Việt):: Khoa/Bộ môn phụ trách:, Hệ Quản trị Cơ sở Dữ liệu: Khoa HTTT\nTên môn học (tiếng Việt):: Giảng viên phụ trách:, Hệ Quản trị Cơ sở Dữ liệu: ThS. Đỗ Thị Minh Phụng, ThS. Thái Bảo Trân Email: phungdtm@uit.edu.vn, trantb@uit.edu.vn\nTên môn học (tiếng Việt):: Giảng viên tham gia giảng dạy:, Hệ Quản trị Cơ sở Dữ liệu: các giảng viên khoa HTTT\nTên môn học (tiếng Việt):: Số tín chỉ:, Hệ Quản trị Cơ sở Dữ liệu: 4 TC lý thuyết : 3 TC thực hành :1\nTên môn học (tiếng Việt):: Lý thuyết: (tiết), Hệ Quản trị Cơ sở Dữ liệu: 45 tiết\nTên môn học (tiếng Việt):: Thực hành: (tiết), Hệ Quản trị Cơ sở Dữ liệu: 30 tiết\nTên môn học (tiếng Việt):: Tính chất của môn, Hệ Quản trị Cơ sở Dữ liệu: Bắt buộc đối với sinh viên ngành/chuyên ngành\nTên môn học (tiếng Việt):: Môn học trước, Hệ Quản trị Cơ sở Dữ liệu: Cơ sở dữ liệu",
          "score": 0.32188618
        },
        {
          "section_id": "dd088817123a",
          "title": "Nhóm các môn học cơ sở ngành",
          "hierarchy_path": "Chương trình Khoa Học Dữ Liệu > Khối kiến thức giáo dục chuyên nghiệp > Nhóm các môn học cơ sở ngành",
          "text_preview": "[Chương trình Khoa Học Dữ Liệu > Khối kiến thức giáo dục chuyên nghiệp > Nhóm các môn học cơ sở ngành]\n\n‒ **Bắt buộc** đối với tất cả sinh viên ngành Khoa học Dữ liệu (tổng cộng **42** tín chỉ).\n\n‒ Cung cấp kiến thức nền tảng về Khoa học Dữ liệu.\n\n**Chú thích:**\n\n‒ TC: Số tín chỉ của môn học.\n\n‒ LT: Số tín chỉ lý thuyết của môn học.\n\n‒ TH: Số tín chỉ thực hành của môn học.\n\n[Bảng 1] Bảng 19 hàng x 6 cột. Các cột: STT, Mã môn học, Tên môn học, ...\n: STT, : Mã môn học, : Tên môn học, : TC, : LT, : TH\nSTT: Giới thiệu ngành, TC: 1, LT: 1, TH: 0\nSTT: 1, Mã môn học: DS005, Tên môn học: Giới thiệu ngành Khoa học dữ liệu, TC: 1, LT: 1, TH: 0\nSTT: Kiến thức về lập trình, TC: 8, LT: 6, TH: 2\nSTT: 2, Mã môn học: IT002, Tên môn học: Lập trình hướng đối tượng, TC: 4, LT: 3, TH: 1\nSTT: 3, Mã môn học: IT003, Tên môn học: Cấu trúc dữ liệu và giải thuật, TC: 4, LT: 3, TH: 1\nSTT: Kiến thức về cơ sở dữ liệu, TC: 4, LT: 3, TH: 1\nSTT: 4, Mã môn học: IT004, Tên môn học: Cơ sở dữ liệu, TC: 4, LT: 3, TH: 1\nSTT: Kiến thức về mạng máy tính, TC: 4, LT: 3, TH: 1\nSTT: 5, Mã môn học: IT005, Tên môn học: Nhập môn mạng máy tính, TC: 4, LT: 3, TH: 1\nSTT: Kiến thức về phần cứng máy tính, TC: 6, LT: 5, TH: 1\nSTT: 6, Mã môn học: IT010, Tên môn học: Tổ chức và cấu trúc máy tính, TC: 2, LT: 2, TH: 0\nSTT: 7, Mã môn học: IT007, Tên môn học: Hệ điều hành, TC: 4, LT: 3, TH: 1\nSTT: Kiến thức nền tảng về Khoa học Dữ liệu, TC: 19, LT: 14, TH: 5\nSTT: 8, Mã môn học: DS107, Tên môn học: Tư duy tính toán cho Khoa học dữ liệu, TC: 4, LT: 3, TH: 1\nSTT: 9, Mã môn học: DS101, Tên môn học: Thống kê và xác suất chuyên sâu, TC: 3, LT: 2, TH: 1\nSTT: 10, Mã môn học: DS111, Tên môn học: Phân tích dữ liệu, TC: 4, LT: 3, TH: 1\nSTT: 11, Mã môn học: DS102, Tên môn học: Học máy thống kê, TC: 4, LT: 3, TH: 1\nSTT: 12, Mã môn học: DS108, Tên môn học: Tiền xử lý và xây dựng bộ dữ liệu, TC: 4, LT: 3, TH: 1\nSTT: Tổng số tín chỉ, TC: 42, LT: 32, TH: 10",
          "score": 0.0018102111
        },
        {
          "section_id": "f7945dbee3be",
          "title": "MỤC TIÊU MÔN HỌC (Course Goals)",
          "hierarchy_path": "IS210 -- HỆ QUẢN TRỊ CƠ SỞ DỮ LIỆU > MỤC TIÊU MÔN HỌC (Course Goals)",
          "text_preview": "[IS210 -- HỆ QUẢN TRỊ CƠ SỞ DỮ LIỆU > MỤC TIÊU MÔN HỌC (Course Goals)]\n\nBảng 1.\n\n[Bảng 1] Bảng 3 hàng x 3 cột. Các cột: ## Mục tiêu [1], ## Mục tiêu môn học [2], Chuẩn đầu ra trong CTĐT\n: ## Mục tiêu [1], : ## Mục tiêu môn học [2], : Chuẩn đầu ra trong CTĐT\n## Mục tiêu [1]: G1, ## Mục tiêu môn học [2]: Hiểu được các khái niệm cơ bản: HQTCSDL, các mức trừu tượng của dữ liệu, kiến trúc HQTCSDL, giao tác, lịch thao tác, truy xuất đồng thời, an toàn và bảo mật, tối ưu hóa câu truy vấn..., Chuẩn đầu ra trong CTĐT: LO2 (2.7)\n## Mục tiêu [1]: G2 +------------------------------------------------------------------------------------------------------------------------------------------------------------------------------------------+ +------------------------------------------------------------------------------------------------------------------------------------------------------------------------------------------+ +------------------------------------------------------------------------------------------------------------------------------------------------------------------------------------------+, ## Mục tiêu môn học [2]: - Kỹ năng xây dựng giao tác tường minh - Kỹ năng giải quyết được các vấn đề có thể xảy ra khi cho nhiều giao tác thực hiện đồng thời - Kỹ năng liên quan đến cơ chế an toàn và khôi phục dữ liệu sau sự cố - Kỹ năng viết câu truy vấn tối ưu, Chuẩn đầu ra trong CTĐT: LO4 (4.1, 4.2)\n## Mục tiêu [1]: G3 +------------------------------------------------------------------------------------------------------------------------------------------------------------------------------------------+, ## Mục tiêu môn học [2]: - Vận dụng thành thạo ngôn ngữ SQL nâng cao, cài đặt được trên một HQTCSDL thương mại (MS SQL Server, Oracle, DB2, MySQL, ...) - Hiện thực yêu cầu tối ưu hoá câu truy vấn trên một HQTCSDL thương mại (MS SQL Server, Oracle, DB2, MySQL, ...), Chuẩn đầu ra trong CTĐT: LO4 (4.1, 4.2)",
          "score": 0.0008295892
        }
      ]
    },
    {
      "question": "Ngành Kĩ thuật phần mềm khác gì với ngành công nghệ thông tin v",
      "answer": "Dựa trên các thông tin được cung cấp, ngành Kỹ thuật phần mềm và ngành Công nghệ Thông tin có những khác biệt chính sau:\n\n*   **Tập trung chuyên môn:** Ngành Kỹ thuật phần mềm tập trung vào việc thiết kế, phát triển và bảo trì các phần mềm máy tính. Trong khi đó, ngành Công nghệ Thông tin có phạm vi rộng hơn, bao gồm cả việc vận hành, quản lý và khai thác các ứng dụng công nghệ thông tin trong nhiều lĩnh vực khác nhau, bao gồm cả việc phân tích dữ liệu, ứng dụng truyền thông xã hội và công nghệ Web.\n*   **Mục tiêu đào tạo:** Ngành Kỹ thuật phần mềm đào tạo nguồn nhân lực có kiến thức chuyên sâu về phát triển phần mềm, trong khi ngành Công nghệ Thông tin đào tạo nguồn nhân lực có khả năng vận hành, quản lý và khai thác các ứng dụng công nghệ thông tin trong các doanh nghiệp và đơn vị không chuyên về CNTT.\n*   **Phạm vi ứng dụng:** Ngành Kỹ thuật phần mềm tập trung vào việc phát triển các ứng dụng phần mềm, trong khi ngành Công nghệ Thông tin có thể áp dụng trong nhiều lĩnh vực khác nhau, bao gồm cả các lĩnh vực như địa lý, môi trường, viễn thám.\n\nTóm lại, ngành Kỹ thuật phần mềm là một chuyên ngành hẹp tập trung vào phát triển phần mềm, trong khi ngành Công nghệ Thông tin là một ngành rộng hơn, bao gồm nhiều khía cạnh khác nhau của công nghệ thông tin.",
      "contexts": [
        "[Chương Trình Kỹ Thuật Phần Mềm > Quan điểm xây dựng chương trình đào tạo]\n\nChương trình đào tạo cử nhân Kỹ thuật phần mềm được xây dựng trên quan điểm:\n\nChương trình đào tạo mang tính liên ngành, tính nghiên cứu và tính ứng dụng cao, phù hợp với nhu cầu nhân lực Công nghệ phần mềm của xã hội hiện nay… Chương trình gần với chương trình đào tạo ngành Kỹ thuật phần mềm của nhiều trường đại học trong nước và trên thế giới để có thể hợp tác quốc tế và đào tạo nâng cao sau này.\n\nCán bộ nghiên cứu và ứng dụng Công nghệ thông tin ở các viện, trung tâm nghiên cứu và các trường đại học, cao đẳng. Giảng dạy các môn liên quan đến công nghệ thông tin, công nghệ phần mềm tại các trường đại học, cao đẳng, trung học chuyên nghiệp, dạy nghề và các trường phổ thông.\n\nNghiên cứu khoa học thuộc các lĩnh vực về công nghệ phần mềm và các hệ thống nhúng ở các viện nghiên cứu, các trung tâm và cơ quan nghiên cứu của các Bộ, Ngành, các trường Đại học và Cao đẳng.\n\nLàm việc ở bộ phận công nghệ thông tin hoặc cần ứng dụng công nghệ thông tin của tất cả các đơn vị có nhu cầu (hành chính sự nghiệp, ngân hàng, viễn thông, hàng không, xây dựng…).\n\nLàm việc trong các công ty sản xuất, gia công phần mềm trong nước cũng như nước ngoài. Làm việc tại các công ty tư vấn về đề xuất giải pháp, xây dựng và bảo trì các hệ thống phần mềm.",
        "[Chương Trình Kỹ Thuật Phần Mềm > Mục tiêu đào tạo]\n\nChương trình đào tạo hướng đến đào tạo nguồn nhân lực công nghệ thông tin chất lượng cao đạt trình độ khu vực và quốc tế, đáp ứng nhu cầu xây dựng nguồn nhân lực ngành công nghiệp công nghệ thông tin trong cả nước.\n\nSinh viên tốt nghiệp chương trình Cử nhân chính quy ngành Kỹ thuật phần mềm phải đáp ứng các yêu cầu:\n\n\\- Có kiến thức cơ bản vững vàng, trình độ chuyên môn giỏi, kỹ năng phát triển phần mềm chuyên nghiệp, có năng lực nghiên cứu và tư duy sáng tạo.\n- Nắm vững quy trình xây dựng và phát triển phần mềm; có khả năng triển khai, xây dựng các hệ thống ứng dụng tin học, phân tích, thiết kế và phát triển các phần mềm có giá trị thực tiễn cao, mang tính thông minh và sáng tạo; đồng thời tuân thủ các nguyên tắc đạo đức nghề nghiệp, pháp luật và có trách nhiệm với xã hội trong quá trình phát triển phần mềm.\n\n\\- Có trình độ tiếng Anh tốt, có thể giao tiếp, làm việc với các chuyên gia, đồng nghiệp nước ngoài.\n\n\\- Khóa luận tốt nghiệp có thể ươm mầm cho các phần mềm trong tương lai.",
        "[Chương Trình Kỹ Thuật Phần Mềm > Vị trí và khả năng làm việc sau tốt nghiệp]\n\nSinh viên tốt nghiệp ngành Kỹ thuật phần mềm có thể làm việc ở các phạm vi và lĩnh vực khác nhau như:\n\nChuyên viên phân tích, thiết kế, cài đặt, quản trị, bảo trì các phần mềm máy tính đáp ứng các ứng dụng khác nhau trong các cơ quan, công ty, trường học... Học tiếp các bậc học cao hơn của ngành Kỹ thuật phần mềm hoặc các ngành liên quan như Khoa học máy tính, Công nghệ thông tin, Hệ thống thông tin tại các cơ sở đào tạo trong và ngoài nước.",
        "[Ngành Kỹ Thuật Máy Tính > Vị trí và khả năng làm việc sau tốt nghiệp]\n\nSinh viên tốt nghiệp ngành Kỹ thuật máy tính có thể làm việc ở các phạm vi và lĩnh vực khác nhau như:\n\n- Chuyên viên phân tích, thiết kế, phát triển thuộc các dự án phát triển giải pháp phần mềm máy tính, thiết kế các hệ thống số, hệ thống nhúng, hệ thống IoT và ứng dụng trí tuệ nhân tạo.\n\n- Cán bộ nghiên cứu và ứng dụng Công nghệ thông tin ở các viện, trung tâm nghiên cứu và các trường đại học, cao đẳng. Giảng dạy các môn liên quan đến kỹ thuật máy tính tại các trường đại học, cao đẳng, trung học chuyên nghiệp, dạy nghề và các trường phổ thông.\n\n- Nghiên cứu khoa học thuộc các lĩnh vực về phần mềm hệ thống, thiết kế hệ thống số, điều khiển tự động và các hệ thống nhúng ở các viện nghiên cứu, các trung tâm và cơ quan nghiên cứu của các bộ, ngành, các trường đại học và cao đẳng.\n\n- Làm việc ở bộ phận công nghệ thông tin hoặc cần ứng dụng công nghệ thông tin của tất cả các đơn vị có nhu cầu (hành chính sự nghiệp, ngân hàng, viễn thông, hàng không, xây dựng,…).\n\n- Làm việc trong các công ty sản xuất trong lĩnh vực điện tử, tự động hóa và giải pháp thông minh trong và ngoài nước.\n\n- Tham gia các chương trình đào tạo sau đại học của ngành KTMT và các ngành phù hợp khác.",
        "[Ngành Công Nghệ Thông Tin > Quan điểm xây dựng chương trình đào tạo]\n\nChương trình được thiết kế sao cho đảm bảo đủ độ phủ, độ sâu nhất định nhằm tạo điều kiện, cơ hội phát triển cho sinh viên làm việc, và có thể tiếp tục nghiên cứu chuyên sâu về các chuyên ngành CNTT, trong đó độ phủ được đặt trọng tâm.\n\nChương trình được thiết kế với mục tiêu phát triển nguồn nhân lực phục vụ cho công cuộc phát triển và hội nhập của đất nước:\n\n\\- Đào tạo nguồn nhân lực có khả năng để vận hành, quản lý, giám sát; phân tích và phát triển các ứng dụng công nghệ thông tin tại các doanh nghiệp, các đơn vị không chuyên về CNTT nhằm tạo ra các giá trị lợi ích gia tăng cho các doanh nghiệp;\n\n\\- Đào tạo nguồn nhân lực có khả năng khai thác dữ liệu và thông tin ứng dụng cho các doanh nghiệp trong vấn đề phân tích định lượng;\n\n\\- Đào tạo nguồn nhân lực có kĩ năng phát triển ứng dụng truyền thông xã hội và công nghệ Web;\n\n\\- Đào tạo nguồn nhân lực kỹ thuật tham gia các quy trình thiết kế, xây dựng, quản lý các dự án nghiên cứu và ứng dụng CNTT, chủ yếu trong lĩnh vực: địa lý, môi trường, viễn thám.\n\nChương trình được thiết kế, xây dựng dựa vào tầm nhìn và sứ mệnh nhà trường; phiếu góp ý của doanh nghiệp, sinh viên tốt nghiệp, giảng viên giảng dạy và tài liệu tham khảo chính là Chương trình đào tạo Đại học về Công nghệ Thông tin của ACM (Association for Computing Machinery) và IEEE Computer Society ấn hành.\n\n![](https://33333.cdn.cke-cs.com/kSW7V9NHUXugvhoQeFaf/images/66bdbdd08b03669bc4e66c80fec444532e2753890f2e8c8e.png)\n\n**Hình 1: Mô tả ngành Công nghệ Thông tin**\n\nNhững **trụ cột** của CNTT bao gồm lập trình, mạng máy tính, giao tiếp người-máy, cơ sở dữ liệu, và hệ thống web, được xây dựng trên một nền tảng kiến thức về các **nền tảng cơ bản&#xA0;**&#x63;ủa CNTT. Bao quát toàn bộ **phần nền tảng** và **trụ cột&#xA0;**&#x6C;à những ứng dụng trong CNTT như là Đảm bảo và An ninh Thông tin, ứng dụng, v.v. Tuy không mô tả hết tất cả các khía cạnh của ngành CNTT, nhưng nó sẽ làm rõ mô tả của những mối quan hệ của các thành phần chính trong CNTT."
      ],
      "ground_truth": "",
      "expected_intent": "compare",
      "metadata": {
        "major_used": null,
        "chunks_retrieved": 0,
        "sections_retrieved": 5,
        "total_time_ms": 16130.629301071167
      },
      "sources": [
        {
          "section_id": "e90243196170",
          "title": "Quan điểm xây dựng chương trình đào tạo",
          "hierarchy_path": "Chương Trình Kỹ Thuật Phần Mềm > Quan điểm xây dựng chương trình đào tạo",
          "text_preview": "[Chương Trình Kỹ Thuật Phần Mềm > Quan điểm xây dựng chương trình đào tạo]\n\nChương trình đào tạo cử nhân Kỹ thuật phần mềm được xây dựng trên quan điểm:\n\nChương trình đào tạo mang tính liên ngành, tính nghiên cứu và tính ứng dụng cao, phù hợp với nhu cầu nhân lực Công nghệ phần mềm của xã hội hiện nay… Chương trình gần với chương trình đào tạo ngành Kỹ thuật phần mềm của nhiều trường đại học trong nước và trên thế giới để có thể hợp tác quốc tế và đào tạo nâng cao sau này.\n\nCán bộ nghiên cứu và ứng dụng Công nghệ thông tin ở các viện, trung tâm nghiên cứu và các trường đại học, cao đẳng. Giảng dạy các môn liên quan đến công nghệ thông tin, công nghệ phần mềm tại các trường đại học, cao đẳng, trung học chuyên nghiệp, dạy nghề và các trường phổ thông.\n\nNghiên cứu khoa học thuộc các lĩnh vực về công nghệ phần mềm và các hệ thống nhúng ở các viện nghiên cứu, các trung tâm và cơ quan nghiên cứu của các Bộ, Ngành, các trường Đại học và Cao đẳng.\n\nLàm việc ở bộ phận công nghệ thông tin hoặc cần ứng dụng công nghệ thông tin của tất cả các đơn vị có nhu cầu (hành chính sự nghiệp, ngân hàng, viễn thông, hàng không, xây dựng…).\n\nLàm việc trong các công ty sản xuất, gia công phần mềm trong nước cũng như nước ngoài. Làm việc tại các công ty tư vấn về đề xuất giải pháp, xây dựng và bảo trì các hệ thống phần mềm.",
          "score": 0.9945095
        },
        {
          "section_id": "da44e346033a",
          "title": "Mục tiêu đào tạo",
          "hierarchy_path": "Chương Trình Kỹ Thuật Phần Mềm > Mục tiêu đào tạo",
          "text_preview": "[Chương Trình Kỹ Thuật Phần Mềm > Mục tiêu đào tạo]\n\nChương trình đào tạo hướng đến đào tạo nguồn nhân lực công nghệ thông tin chất lượng cao đạt trình độ khu vực và quốc tế, đáp ứng nhu cầu xây dựng nguồn nhân lực ngành công nghiệp công nghệ thông tin trong cả nước.\n\nSinh viên tốt nghiệp chương trình Cử nhân chính quy ngành Kỹ thuật phần mềm phải đáp ứng các yêu cầu:\n\n\\- Có kiến thức cơ bản vững vàng, trình độ chuyên môn giỏi, kỹ năng phát triển phần mềm chuyên nghiệp, có năng lực nghiên cứu và tư duy sáng tạo.\n- Nắm vững quy trình xây dựng và phát triển phần mềm; có khả năng triển khai, xây dựng các hệ thống ứng dụng tin học, phân tích, thiết kế và phát triển các phần mềm có giá trị thực tiễn cao, mang tính thông minh và sáng tạo; đồng thời tuân thủ các nguyên tắc đạo đức nghề nghiệp, pháp luật và có trách nhiệm với xã hội trong quá trình phát triển phần mềm.\n\n\\- Có trình độ tiếng Anh tốt, có thể giao tiếp, làm việc với các chuyên gia, đồng nghiệp nước ngoài.\n\n\\- Khóa luận tốt nghiệp có thể ươm mầm cho các phần mềm trong tương lai.",
          "score": 0.95822614
        },
        {
          "section_id": "be0311136a43",
          "title": "Vị trí và khả năng làm việc sau tốt nghiệp",
          "hierarchy_path": "Chương Trình Kỹ Thuật Phần Mềm > Vị trí và khả năng làm việc sau tốt nghiệp",
          "text_preview": "[Chương Trình Kỹ Thuật Phần Mềm > Vị trí và khả năng làm việc sau tốt nghiệp]\n\nSinh viên tốt nghiệp ngành Kỹ thuật phần mềm có thể làm việc ở các phạm vi và lĩnh vực khác nhau như:\n\nChuyên viên phân tích, thiết kế, cài đặt, quản trị, bảo trì các phần mềm máy tính đáp ứng các ứng dụng khác nhau trong các cơ quan, công ty, trường học... Học tiếp các bậc học cao hơn của ngành Kỹ thuật phần mềm hoặc các ngành liên quan như Khoa học máy tính, Công nghệ thông tin, Hệ thống thông tin tại các cơ sở đào tạo trong và ngoài nước.",
          "score": 0.93220687
        },
        {
          "section_id": "4a360f19b8ed",
          "title": "Vị trí và khả năng làm việc sau tốt nghiệp",
          "hierarchy_path": "Ngành Kỹ Thuật Máy Tính > Vị trí và khả năng làm việc sau tốt nghiệp",
          "text_preview": "[Ngành Kỹ Thuật Máy Tính > Vị trí và khả năng làm việc sau tốt nghiệp]\n\nSinh viên tốt nghiệp ngành Kỹ thuật máy tính có thể làm việc ở các phạm vi và lĩnh vực khác nhau như:\n\n- Chuyên viên phân tích, thiết kế, phát triển thuộc các dự án phát triển giải pháp phần mềm máy tính, thiết kế các hệ thống số, hệ thống nhúng, hệ thống IoT và ứng dụng trí tuệ nhân tạo.\n\n- Cán bộ nghiên cứu và ứng dụng Công nghệ thông tin ở các viện, trung tâm nghiên cứu và các trường đại học, cao đẳng. Giảng dạy các môn liên quan đến kỹ thuật máy tính tại các trường đại học, cao đẳng, trung học chuyên nghiệp, dạy nghề và các trường phổ thông.\n\n- Nghiên cứu khoa học thuộc các lĩnh vực về phần mềm hệ thống, thiết kế hệ thống số, điều khiển tự động và các hệ thống nhúng ở các viện nghiên cứu, các trung tâm và cơ quan nghiên cứu của các bộ, ngành, các trường đại học và cao đẳng.\n\n- Làm việc ở bộ phận công nghệ thông tin hoặc cần ứng dụng công nghệ thông tin của tất cả các đơn vị có nhu cầu (hành chính sự nghiệp, ngân hàng, viễn thông, hàng không, xây dựng,…).\n\n- Làm việc trong các công ty sản xuất trong lĩnh vực điện tử, tự động hóa và giải pháp thông minh trong và ngoài nước.\n\n- Tham gia các chương trình đào tạo sau đại học của ngành KTMT và các ngành phù hợp khác.",
          "score": 0.92827886
        },
        {
          "section_id": "197c31f4cd93",
          "title": "Quan điểm xây dựng chương trình đào tạo",
          "hierarchy_path": "Ngành Công Nghệ Thông Tin > Quan điểm xây dựng chương trình đào tạo",
          "text_preview": "[Ngành Công Nghệ Thông Tin > Quan điểm xây dựng chương trình đào tạo]\n\nChương trình được thiết kế sao cho đảm bảo đủ độ phủ, độ sâu nhất định nhằm tạo điều kiện, cơ hội phát triển cho sinh viên làm việc, và có thể tiếp tục nghiên cứu chuyên sâu về các chuyên ngành CNTT, trong đó độ phủ được đặt trọng tâm.\n\nChương trình được thiết kế với mục tiêu phát triển nguồn nhân lực phục vụ cho công cuộc phát triển và hội nhập của đất nước:\n\n\\- Đào tạo nguồn nhân lực có khả năng để vận hành, quản lý, giám sát; phân tích và phát triển các ứng dụng công nghệ thông tin tại các doanh nghiệp, các đơn vị không chuyên về CNTT nhằm tạo ra các giá trị lợi ích gia tăng cho các doanh nghiệp;\n\n\\- Đào tạo nguồn nhân lực có khả năng khai thác dữ liệu và thông tin ứng dụng cho các doanh nghiệp trong vấn đề phân tích định lượng;\n\n\\- Đào tạo nguồn nhân lực có kĩ năng phát triển ứng dụng truyền thông xã hội và công nghệ Web;\n\n\\- Đào tạo nguồn nhân lực kỹ thuật tham gia các quy trình thiết kế, xây dựng, quản lý các dự án nghiên cứu và ứng dụng CNTT, chủ yếu trong lĩnh vực: địa lý, môi trường, viễn thám.\n\nChương trình được thiết kế, xây dựng dựa vào tầm nhìn và sứ mệnh nhà trường; phiếu góp ý của doanh nghiệp, sinh viên tốt nghiệp, giảng viên giảng dạy và tài liệu tham khảo chính là Chương trình đào tạo Đại học về Công nghệ Thông tin của ACM (Association for Computing Machinery) và IEEE Computer Society ấn hành.\n\n![](https://33333.cdn.cke-cs.com/kSW7V9NHUXugvhoQeFaf/images/66bdbdd08b03669bc4e66c80fec444532e2753890f2e8c8e.png)\n\n**Hình 1: Mô tả ngành Công nghệ Thông tin**\n\nNhững **trụ cột** của CNTT bao gồm lập trình, mạng máy tính, giao tiếp người-máy, cơ sở dữ liệu, và hệ thống web, được xây dựng trên một nền tảng kiến thức về các **nền tảng cơ bản&#xA0;**&#x63;ủa CNTT. Bao quát toàn bộ **phần nền tảng** và **trụ cột&#xA0;**&#x6C;à những ứng dụng trong CNTT như là Đảm bảo và An ninh Thông tin, ứng dụng, v.v. Tuy không mô tả hết tất cả các khía cạnh của ngành CNTT, nhưng nó sẽ làm rõ mô tả của những mối quan hệ của các thành phần chính trong CNTT.",
          "score": 0.05592617
        }
      ]
    }
  ]
}